id	text	HS	TR	AG
21258	rn vmip000 cs da0000 nc0s000 fh nc0s000 vsip000 pd000000 vsip000 np00000 np00000 vmii000 rg dd0000 np00000 pr000000 vmis000 word	0	0	0
21259	da0000 np00000 sp000 ao0000 nc0s000 nc0s000 np00000 sp000 da0000 np00000 np00000 aq0000 sp000 aq0000 nc0s000 z0 np00000 nc0s000 np00000 np00000 np00000 np00000 np00000 aq0000 aq0000 vmii000	0	0	0
21260	cc vmip000 da0000 nc0s000 sp000 vmn0000 vmm0000 da0000 z0 nc00000 pr000000 rn vmip000 da0000 pr000000 pp000000 vmip000 cs rn vmip000 aq0000 nc0s000 pr000000 nc0s000 fh nc0s000 np00000 cc word vmip000 vmn0000 sp000 np00000 cs np00000 sp000 pt000000 np00000	1	1	1
21261	vmm0000 cs fh pt000000 vmis000 nc0s000 fh aq0000 cs fh pt000000 pp000000 np00000 np00000 sp000 np00000	1	1	1
21262	pp000000 vmip000	0	0	0
21264	i vaip000 vmis000 nc0s000 aq0000 np00000 vmis000 np00000 pp000000 vsip000 aq0000	1	1	1
21265	vmip000 aq0000 nc0p000 sp000 nc0s000 nc0s000 nc0s000 pr000000 np00000 cc nc0s000 da0000 nc0s000 np00000 fp cc da0000 nc0p000 pr000000 fh pt000000 vmis000 vmic000 vmn0000 sp000 nc0s000 sp000 np00000 np00000	0	0	0
21266	cs vmip000 di0000 vssp000 vmp0000 nc0s000 da0000 nc0s000 sp000 nc0s000 aq0000 nc0s000 vsip000 nc0s000 dd0000 nc0s000 nc0s000 vaip000 sp000 pt000000 np00000 np00000	0	0	0
21267	vmis000 nc0s000 sp000 nc0s000 aq0000 nc0s000	0	0	0
21268	nc0p000 sp000 nc0s000 aq0000 cc da0000 nc0s000 sp000 vmn0000 da0000 nc0s000 nc0s000	0	0	0
21270	sp000 nc0s000 nc0s000 np00000 np00000 nc0s000 fh aq0000 vmii000 cs pp000000 vmsp000 nc0s000 fh aq0000 np00000 sp000 van0000 vmp0000 np00000 sp000 np00000 sp000 pt000000 vsip000 np00000 sp000 pt000000 vmis000 aq0000 sp000 pt000000 vsis000 aq0000 di0000 da0000 np00000	1	1	0
21271	i pt000000 vmis000 di0000 da0000 nc0n000 pt000000 np00000	0	0	0
21272	nc0s000 pp000000 nc0s000 vmis000 da0000 nc0s000 sp000 da0000 nc0s000 aq0000	0	0	0
21273	np00000 np00000 vmip000 sp000 z0 aq0000 z0 vmii000 aq0000 sp000 nc0p000 sp000 np00000	0	0	0
21274	vmsp000 vmp0000 vmip000 nc0s000 vmis000 vmis000 z0 sp000 nc0s000 aq0000 nc0s000 sp000 nc0s000	0	0	0
21275	vmip000 nc0s000 aq0000 sp000 nc0s000 sp000 nc0p000 aq0000 sp000 np00000 f0 np00000 np00000 np00000	0	0	0
21276	nc0s000 nc0s000 sp000 vmn0000 nc0s000	1	1	1
21278	vmm0000 sp000 vmn0000 da0000 nc0s000 pr000000 pp000000 vmsp000 da0000 nc0s000 vmip000 sp000 nc0s000 fh aq0000 np00000 vsip000 di0000 np00000 np00000 vmn0000 nc0s000 sp000 vsn0000 np00000 vmip000 cs sp000 nc0s000 sp000 da0000 pr000000 vmip000 nc00000 sp000 nc0s000 aq0000 sp000 aq0000 nc0s000	0	0	0
21279	np00000 nc0s000 aq0000 sp000 dd0000 nc0s000 pr000000 fh pt000000 pp000000 vmip000 sp000 vmn0000 aq0000 sp000 di0000 np00000 aq0000 da0000 pr000000 fh pt000000 pp000000 vaip000 vmp0000 nc0s000 sp000 np00000 np00000 nc0s000 pi000000 nc0s000 fh aq0000 vmis000 sp000 nc0s000 np00000	0	0	0
21280	nc0s000 sp000 pr000000 nc0s000 da0000 vmis000 dd0000 nc0s000 sp000 np00000 sp000 np00000	0	0	0
21281	vmip000 sp000 nc0p000 sp000 np00000 sp000 pr000000 sp000 dp0000 nc0p000 aq0000	0	0	0
21283	vmip000 sp000 da0000 nc0p000 p0000000 vmii000 sp000 nc0s000 nc0s000 aq0000 fh nc0p000 aq0000 cc nc0s000 fh aq0000 p0000000 vmip000 sp000 np00000 p0000000 vmip000 sp000 vsn0000 di0000 sp000 nc0p000 cc pp000000 vmip000 sp000 nc0s000 sp000 nc0s000 nc0s000 sp000 nc0s000 sp000 pd000000 da0000 di0000 pr000000 nc0s000 fh aq0000 nc0p000 sp000 np00000 np00000 np00000 nc0s000 pr000000 fh pt000000 rg p0000000 vmip000 nc0p000 cc di0000 np00000 np00000 np00000 sp000 np00000	1	0	1
21285	aq0000 nc0p000 np00000 sp000 nc0s000 sp000 nc0s000 fh dp0000 nc0p000 fh sp000 nc0s000 sp000 da0000 nc0s000 sp000 nc0s000 vmis000 sp000 vmn0000 cc aq0000 nc0s000 sp000 nc0s000 sp000 nc0s000 sp000 nc0s000 np00000 dt0000 nc0s000 fh aq0000 vmip000 rg cc np00000 np00000	0	0	0
21286	vmii000 sp000 nc0p000 np00000 rg vmip000 nc0s000 aq0000 nc0s000	0	0	0
21287	dd0000 nc0s000 nc0s000 z0 np00000 np00000 np00000	1	1	1
21288	aq0000 z0 nc0p000 sp000 nc0s000 vmsp000 cc vmip000 dn0000 nc0s000 vmg0000 sp000 nc0s000 fh aq0000 nc0s000 nc0s000 pr000000 vaip000 vmp0000 vmis000 da0000 aq0000 nc0s000	0	0	0
21289	nc0s000 aq0000 vmn0000 da0000 nc0s000 sp000 nc0s000 nc0s000 sp000 nc0s000 i cc vmn0000 rg vmn0000 nc0s000 nc0s000 fh aq0000 nc0s000 sp000 dp0000 nc0s000 da0000 nc0s000 aq0000 nc00000 dd0000 nc0s000 aq0000 cs nc0s000 vmip000 rg aq0000	0	0	0
21290	nc0s000 fh sp000 nc0s000 fh nc0s000 aq0000 fh nc0p000 aq0000 pr000000 pp000000 nc0s000 fh nc0s000 np00000 vmip000 pi000000 nc0s000 np00000 pr000000 vmip000 cs nc0s000 fh nc0s000 np00000 cc pp000000 vmip000 da0000 nc0s000 cs rg pp000000 vmip000 sp000 sp000 da0000 np00000	1	1	1
21291	vmis000 rg rg nc0s000 fh aq0000 nc0s000 cc nc0s000 nc0s000 aq0000 fh nc0p000 aq0000 vmn0000 rg nc0p000 sp000 rg nc0p000 rn vmip000 nc0s000 aq0000 pd000000 vsip000 sp000 pi000000 cc rg sp000 np00000 pp000000 vmif000 sp000 da0000 np00000	0	0	0
21292	nc0p000 sp000 nc0s000 pi000000 i np00000 vsip000 aq0000 vmn0000 cc np00000 di0000 da0000 pr000000 vaip000 nc0s000	0	0	0
21293	np00000 np00000 cc di0000 aq0000 vmn0000 sp000 vmn0000 sp000 da0000 aq0000 aq0000 sp000 np00000 cc rn np00000 z0 fg da0000 nc0s000 sp000 da0000 nc0p000 sp000 di0000 nc0s000 vmip000 sp000 np00000 sp000 di0000 nc0s000 nc0s000	1	0	0
21294	vmsp000 di0000 nc0s000 sp000 nc0s000 aq0000	1	1	1
21295	i nc0s000 nc0s000 fh aq0000 nc0s000 vaip000 vmp0000 da0000 nc0p000 sp000 da0000 nc0s000 pr000000 pp000000 vaip000 np00000 np00000 np00000 vmip000 da0000 nc0s000 vmip000 da0000 pp000000 vmsp000 pi000000 cc vmip000 aq0000 nc0s000 np00000 vmn0000	0	0	0
21296	dp0000 nc0s000 aq0000 np00000 np00000 vmif000 vmg0000 sp000 da0000 nc0s000 sp000 nc0p000 pr000000 di0000 aq0000 sp000 da0000 np00000 np00000 sp000 cc np00000 np00000 vmn0000 sp000 da0000 np00000 w z0 np00000	0	0	0
21298	pr000000 da0000 np00000 vsip000 np00000 np00000 fit rn np00000 rn vmip000 np00000 np00000 np00000 aq0000 nc0s000 pr000000 pp000000 nc0s000 rn pp000000 np00000	0	0	0
21299	nc0s000 da0000 nc0p000 nc0s000 nc0s000 fh aq0000 vmip000 vmn0000 pi000000 np00000 cc pd000000 nc0s000 pp000000 vmip000 da0000 nc0p000 np00000 pr000000 rg vaip000 vmp0000 sp000 np00000 fp	1	0	0
21300	vsip000 rg aq0000 cs fh pt000000 vmip000 sp000 vmn0000 nc0s000 nc0s000 vsip000 di0000 nc0s000 cc nc0s000 nc0s000 vsip000 pp000000	1	1	1
21301	da0000 aq0000 pr000000 pp000000 vmis000 sp000 np00000 vsis000 pr000000 vasi000 nc0s000 sp000 np00000 fc cs rg pi000000 vmip000 aq0000 nc0p000	0	0	0
21302	np00000 aq0000 nc0s000 fh aq0000 vmp0000 vmis000 nc0p000 sp000 da0000 nc0s000 sp000 da0000 nc0s000	1	1	1
21303	dd0000 nc0s000 vmip000 di0000 nc0s000 aq0000 cc da0000 pr000000 pp000000 vmip000 vsip000 cs vmsp000 cs da0000 nc0s000 vmii000 np00000 np00000 np00000	0	0	0
21304	vmip000 cs nc0s000 aq0000 vmis000 sp000 aq0000 da0000 nc0s000 sp000 da0000 nc0s000 pr000000 nc0s000 fh aq0000 da0000 vmip000 vmg0000 sp000 dp0000 nc0p000 sp000 nc0p000 sp000 nc0s000 fh aq0000 nc0s000 aq0000 fh nc0p000 aq0000 cc sp000 dp0000 np00000	0	0	0
21306	rn vsip000 aq0000 cc pr000000 nc0s000 sp000 np00000 np00000 da0000 np00000 np00000 sp000 pr000000 nc0s000 nc0s000 fh nc0s000 cs aq0000 sp000 np00000 pp000000 np00000 np00000 np00000 np00000 np00000 cc rg nc0p000	1	0	1
21307	cc rg w rg nc0s000 fh aq0000 np00000 cs vmis000 vsn0000 vmp0000 cc vmip000 aq0000 nc0s000 sp000 np00000 np00000 np00000	0	0	0
21308	nc0s000 vsip000 di0000 aq0000 pr000000 fh pt000000 vmip000 vmn0000 sp000 di0000 da0000 np00000 aq0000 vmsi000 nc0p000 vmn0000 nc0s000 nc0s000 aq0000 dd0000 nc0s000 sp000 nc0p000 nc0s000 fh aq0000 nc0s000 sp000 dp0000 nc0s000 nc0s000 rg nc0s000 sp000 da0000 nc0s000 aq0000 nc0s000 sp000 da0000 np00000 sp000 np00000 dn0000 cc z0 np00000 rn vsip000 pi000000	0	0	0
21309	rn nc0s000 vmis000 np00000 nc0s000 nc0s000 vmis000 sp000 da0000 nc0s000 aq0000 sp000 np00000 rg vmip000 nc0s000 np00000 rg pr000000 vmsp000 da0000 nc0s000 np00000	0	0	0
21310	nc0s000 fh nc0s000 vmip000 sp000 dp0000 nc0p000 aq0000 np00000	0	0	0
21311	vmii000 vmn0000 nc0p000 aq0000 fh nc0s000 sp000 nc0s000 sp000 da0000 np00000 nc0s000 fh aq0000 vmii000 di0000 rg sp000 nc0s000 aq0000 sp000 nc0s000 sp000 di0000 aq0000 nc0s000 vsip000 rg da0000 nc0p000 cc nc0p000 sp000 da0000 nc0s000 z0 da0000 nc0p000 rg aq0000 sp000 da0000 np00000 da0000 pr000000 rg p0000000 vmif000 np00000 dd0000 np00000	0	0	0
21312	i word vmn0000 nc0s000 sp000 np00000 vsip000 vmn0000 sp000 nc0s000 vmg0000 nc00000 aq0000 cc dp0000 np00000 aq0000 nc0p000 sp000 pr000000 vmis000 vmsp000 nc0s000 sp000 nc0s000 di0000 np00000	0	0	0
21313	np00000 vmsp000 np00000 vmis000 aq0000 vmis000 rg	1	1	1
21314	cc vmis000 vsip000 da0000 np00000 np00000 np00000 rn vmis000 nc0p000 da0000 np00000 np00000 da0000 pn000000 vmsi000 dd0000 nc0s000 cc vmg0000 da0000 nc0s000 sp000 z0 vmg0000 sp000 nc0s000 rg sp000 np00000 cc vaip000 vmp0000 nc0s000 nc0s000 sp000 nc0s000 aq0000 z0 np00000	0	0	0
21315	vmsp000 nc0s000 sp000 np00000 pp000000 nc0s000 aq0000 nc0s000 fh aq0000 vmis000 sp000 da0000 da0000 nc0p000 cs vsis000 nc0s000 sp000 np00000 np00000 sp000 nc0s000 sp000 nc0s000 vsip000	1	1	1
21316	di0000 nc0s000 vsip000 rg np00000 np00000 np00000	1	1	1
21317	np00000 np00000 sp000 pt000000 pp000000 vmip000	1	1	1
21318	da0000 nc0s000 sp000 aq0000 nc0s000 vaip000 sp000 nc0s000 np00000 da0000 vmip000 sp000 vmn0000 da0000 w	0	0	0
21319	np00000 sp000 vmis000 dp0000 nc0p000 nc0s000 vmis000 vmn0000 rg rg cc nc0s000 aq0000 sp000 da0000 nc0s000 aq0000 aq0000 sp000 van0000	0	0	0
21320	vmip000 np00000 pp000000 vmip000 pp000000 vmip000 da0000 rg nc0s000	1	1	0
21321	sp000 vmn0000 aq0000 vsip000 nc0s000 pp000000 vmg0000 sp000 vsn0000 di0000 nc0s000 nc0s000 fh aq0000 vmip000 di0000 pi000000 sp000 nc0s000 sp000 np00000 fp	0	0	0
21322	nc0s000 fh nc0s000 vmis000 di0000 nc0s000 sp000 np00000 cc np00000 vmis000 nc0s000 vsip000 rg np00000 pp000000 vmip000 pi000000 np00000 nc0s000 fh nc0s000 np00000 np00000	0	0	0
21323	i pr000000 aq0000 nc0s000	1	1	1
21324	vmip000 nc0s000 fh aq0000 z0 rg sp000 da0000 z0 zm z0 nc0p000 cc pr000000 rg nc0s000 fh aq0000 nc0s000 p0000000 vmip000 sp000 vmn0000 sp000 nc0p000 sp000 np00000 nc0s000 sp000 aq0000 np00000	1	0	1
21325	np00000 pr000000 vmip000 nc0s000 sp000 pp000000 np00000 nc0s000 fh aq0000 nc0s000 sp000 da0000 nc0s000	0	0	0
21326	pi000000 vsip000 np00000 np00000 cc np00000 np00000 sp000 da0000 nc0p000 sp000 nc0p000 cc nc0p000 sp000 pr000000 vmis000 vmip000 sp000 pi000000 sp000 pp000000 sp000 di0000 nc0s000	1	0	0
21328	np00000 np00000 nc0s000 fh aq0000 np00000	0	0	0
21329	da0000 aq0000 pr000000 vmis000 aq0000 sp000 vsn0000 di0000 nc0s000 aq0000 i	1	1	1
21330	dd0000 nc0s000 vmip000 vmic000 nc0s000	1	1	1
21331	da0000 nc0s000 vsip000 rg aq0000 cc da0000 nc0s000 vmip000 vmg0000 sp000 pp000000 fc nc0s000 nc0s000 nc0s000 da0000 nc0s000 aq0000 rg nc0s000 cc da0000 nc0s000 vmn0000 rg nc0s000 rg fc pp000000 rg aq0000	1	1	1
21332	vaip000 di0000 nc0s000 pr000000 vmip000 nc0s000 da0000 nc0s000 nc0s000 np00000 sp000 np00000	0	0	0
21334	pp000000 vsip000 da0000 nc0s000 aq0000 cs vmip000 da0000 nc0s000 cs nc0s000 vmip000 nc0s000 aq0000 pd000000 vsip000 sp000 vmn0000 nc0s000 cc pr000000 vmip000 nc0p000 sp000 pp000000 np00000 np00000 pr000000 vsip000 cc vsif000 rg vmis000 np00000	0	0	0
21336	di0000 nc0s000 vaip000 vmp0000 np00000 cc aq0000 sp000 nc0s000 nc0s000 sp000 np00000 sp000 da0000 aq0000 nc0s000 pr000000 vsip000 vmp0000 cc np00000 np00000 sp000 vmn0000 vmg0000 da0000 nc0s000 sp000 rg aq0000 pr000000 vmsp000 nc0s000 vmsp000 dd0000 nc0s000	0	0	0
21337	cs aq0000 vmn0000 rg np00000 nc0s000 vmip000 vmp0000 sp000 vmn0000 nc0s000 np00000 np00000 vmip000 cs vmsp000 sp000 di0000 nc0s000 word cc vmsp000 pi000000 da0000 pr000000 vmis000	1	1	1
21338	aq0000 pr000000 rg vmip000 sp000 nc0p000 cc aq0000 cc vmip000 aq0000 np00000	0	0	0
21340	aq0000 nc0s000 sp000 nc0s000 cc vmsp000 sp000 da0000 nc0s000 nc0s000	0	0	0
21341	pp000000 vsip000 di0000 rg rg nc0s000 sp000 da0000 aq0000 aq0000 np00000 cc nc0s000 vsip000 di0000 nc0s000 np00000 vsip000 di0000 aq0000 nc0s000 aq0000 nc0s000 nc0s000	0	0	0
21342	pi000000 np00000 nc0s000 pp000000 aq0000 sp000 aq0000 nc0p000 cc nc0p000 nc0s000 di0000 nc0s000 sp000 sp000 aq0000 sp000 nc0s000 nc0s000 sp000 np00000	1	0	1
21343	cc pi000000 sp000 dd0000 nc0p000 sp000 nc0p000 vsip000 sp000 nc0s000 sp000 dp0000 aq0000 np00000 sp000 di0000 nc0s000 rg sp000 vmn0000 nc0s000 da0000 nc0p000	1	0	1
21344	vmip000 np00000 cs sp000 np00000 aq0000 np00000 cc pp000000 vmsp000 di0000 nc0p000 nc0s000 pr000000 vmip000 np00000 nc0s000 cc sp000 da0000 pr000000 rg pp000000 vmip000 dp0000 nc0p000 aq0000 dd0000 nc0s000 nc0s000 np00000	1	1	1
21345	pp000000 vmip000 rg vmip000 rn pp000000 vmip000 np00000	1	1	1
21346	cc pi000000 vmip000 sp000 da0000 aq0000 nc0s000 di0000 nc0s000	1	0	0
21347	i nc0s000 pr000000 vmp0000 rg nc0s000 vmip000 rg nc0s000	1	1	1
21348	sp000 nc0s000 sp000 nc0s000 fh dp0000 nc0p000 fh sp000 nc0s000 sp000 da0000 nc0s000 sp000 nc0s000 vmip000 vmn0000 da0000 nc0s000 sp000 nc0s000 cc vmm0000 sp000 vmn0000	0	0	0
21349	sp000 aq0000 rn rg nc0p000 vmip000	1	0	1
21350	cs nc0s000 vmip000 sp000 np00000 cc sp000 np00000 cc da0000 nc0p000 cc pi000000 sp000 da0000 nc0s000 da0000 nc0s000 vsip000 vmn0000 sp000 nc0s000 sp000 da0000 pr000000 rg pp000000 vmip000 da0000 nc0s000 aq0000 vmic000 vmn0000 di0000 nc0s000 sp000 np00000	0	0	0
21352	aq0000 rg vaip000 sp000 nc0s000 nc0s000 sp000 nc0s000 nc0s000 cc nc0s000 vsip000 aq0000 pt000000 vmsp000 da0000 nc0s000 nc0s000 cc nc0s000 pr000000 vmis000 np00000 cc rg vmis000 nc0s000 vsip000 da0000 nc0s000	0	0	0
21353	pd000000 vsip000 nc0s000 vmn0000 nc0s000 aq0000 pd000000 vsip000 sp000 nc0s000 nc0s000 dn0000 nc0p000 sp000 z0 zm nc0s000 sp000 da0000 np00000	0	0	0
21354	vmsp000 nc0s000 np00000 vmif000 nc0s000 vmsp000 nc0s000 sp000 da0000 np00000 np00000 pr000000 vmip000 da0000 nc0p000 sp000 da0000 nc0s000 np00000 nc0p000 np00000 np00000 sp000 da0000 nc0s000 pr000000 vmis000 aq0000 nc0s000 sp000 nc0s000 sp000 da0000 np00000	1	1	1
21355	np00000 vmn0000 nc0s000 aq0000 nc0s000 aq0000 vmsp000 vmp0000 np00000 np00000 np00000	1	1	1
21356	vmsp000 aq0000 aq0000 sp000 nc0s000 cc vmis000 np00000 np00000 rg pr000000 pp000000 vmip000 vmn0000 sp000 aq0000 nc0s000 nc0s000 np00000	1	1	1
21357	vmm0000 sp000 da0000 nc0p000 sp000 np00000 rg vsip000 np00000 np00000 np00000 aq0000 vmip000 da0000 nc0s000 sp000 vmn0000 sp000 nc0s000 sp000 vmn0000 nc0p000 cc vmg0000 dn0000 sp000 dn0000 nc0p000 dn0000 nc0p000 pr000000 nc0p000 sp000 nc0p000 vmip000 aq0000 cc da0000 nc0p000 rg	0	0	0
21358	vmsp000 nc0s000 sp000 np00000 vmis000 di0000 nc0s000 cc vmip000 sp000 vmn0000 nc0s000 nc0s000 fh nc0s000 vsg0000 di0000 np00000	0	0	0
21359	vmis000 da0000 np00000 aq0000 vsip000 nc0p000 aq0000 nc0s000 nc0s000 di0000 nc0s000	0	0	0
21360	np00000 np00000 np00000 sp000 nc0s000 vsif000 vmp0000 sp000 da0000 np00000 np00000 np00000 sp000 vmn0000 aq0000 nc0s000 da0000 nc0p000 aq0000 cc np00000 nc0s000 np00000 sp000 pr000000 vmip000 np00000 sp000 vmip000 aq0000 aq0000 sp000 nc0s000 rg nc0s000 np00000 cs da0000 nc0s000 pp000000 np00000 vmip000 np00000	1	0	1
21361	da0000 np00000 sp000 np00000 sp000 np00000 np00000 vaip000 vmp0000 nc0s000 np00000 aq0000 aq0000 nc0s000 sp000 np00000 sp000 np00000 np00000 nc0s000 pp000000 vaip000 vmp0000 di0000 nc0s000 sp000 z0 nc0p000 sp000 vmn0000 da0000 np00000 np00000 di0000 np00000 da0000 nc0s000 nc0s000 sp000 da0000 nc0s000 aq0000 vaip000 vmp0000 sp000 nc0s000 fh aq0000 nc0s000 sp000 np00000	0	0	0
21362	np00000 np00000 da0000 np00000 np00000 sp000 dd0000 nc0s000	0	0	0
21363	va00000 vmis000 nc0s000 sp000 vmsp000 sp000 da0000 nc0s000 da0000 aq0000 nc0s000 sp000 nc0p000 sp000 np00000 nc0s000 vmip000 sp000 vmn0000 da0000 z0 i sp000 nc0s000	0	0	0
21364	pp000000 nc0s000 nc0s000 vaip000 vmp0000 nc0s000 sp000 da0000 nc0s000 sp000 da0000 nc0s000 sp000 da0000 aq0000 nc0s000 sp000 np00000 sp000 nc0s000 rg vsip000 pr000000 nc0s000 vmip000 vmn0000 nc0s000 nc0s000 nc0s000 aq0000	0	0	0
21365	fc nc0s000 sp000 da0000 np00000 vmis000 cs nc0p000 aq0000 vsif000 np00000 sp000 fit da0000 aq0000 cs pi000000 vmip000 nc0s000 fh aq0000 nc0s000	1	1	1
21366	aq0000 rg sp000 da0000 nc0s000 aq0000 vmp0000 nc0s000 vsip000 di0000 nc0s000 aq0000 word	0	0	0
21367	rg vmip000 nc0s000 pr000000 vmsp000 da0000 nc0s000 np00000 pr000000 pp000000 da0000 sp000 nc0s000 da0000 pr000000 vmsp000 da0000 np00000 np00000 aq0000 nc0p000 rg word	0	0	0
21368	np00000 vmif000 aq0000 cc nc0p000 sp000 cs sp000 nc0s000 nc0s000 nc0s000 aq0000 np00000	1	1	1
21369	vmsp000 vmsp000 cs vmip000 vmis000 aq0000 sp000 vmn0000 nc0s000 nc0s000	1	1	1
21370	da0000 nc0s000 sp000 np00000 di0000 aq0000 rg vmip000 da0000 nc0s000 sp000 da0000 nc0s000	0	0	0
21371	da0000 np00000 vaip000 vmp0000 sp000 vmn0000 sp000 da0000 pr000000 vmg0000 vmii000 da0000 nc0s000 sp000 np00000 sp000 nc0s000 fh aq0000 vsip000 aq0000 vmn0000 nc00000	1	0	1
21372	np00000 nc0s000 cc pd000000 da0000 nc0p000 rg aq0000 pr000000 vmip000 rg vmn0000 sp000 da0000 nc0s000 pi000000 pp000000 vmip000 cc rg nc0s000 fh nc0s000 np00000	1	0	1
21373	pp000000 vmip000 rg sp000 da0000 nc0s000 vmip000 da0000 nc0s000	0	0	0
21374	da0000 nc0s000 np00000 vmip000 np00000 da0000 nc0s000 sp000 da0000 sp000 nc0s000 sp000 cs vmif000 da0000 nc0p000 sp000 np00000 cc np00000 cs np00000 vmis000 np00000	0	0	0
21375	da0000 nc0s000 vmip000 rg da0000 nc0s000 sp000 nc0s000 sp000 nc0s000 fh dp0000 nc0p000 fh sp000 nc0s000 sp000 da0000 nc0s000 sp000 nc0s000 da0000 np00000	0	0	0
21376	aq0000 vmip000 vmn0000 nc0s000 cs di0000 nc0p000 vmip000 np00000 np00000 dn0000 nc0p000 vsii000 aq0000 sp000 nc0p000 fit	1	0	0
21377	np00000 aq0000 cc vmm0000 sp000 vmn0000	1	1	1
21378	vaip000 vmp0000 sp000 np00000 vmn0000 np00000 nc0s000 vsip000 aq0000 cc vsip000 di0000 aq0000 nc0s000 sp000 di0000 nc0s000 aq0000 sp000 da0000 np00000 sp000 nc0s000 fh aq0000 nc0s000 sp000 pd000000	0	0	0
21379	cc np00000 di0000 da0000 nc0s000 vmg0000 nc0s000	0	0	0
21380	aq0000 da0000 nc0s000 vsip000 rg pi000000 rg aq0000 sp000 da0000 np00000 dp0000 nc0p000 vmis000 cs vmn0000 sp000 da0000 nc0s000 aq0000 sp000 vmn0000 dp0000 np00000 rg nc0s000 nc0s000 fh aq0000 nc0s000 cs di0000 nc0s000 nc0s000 vaip000 vmp0000 da0000 nc0s000	0	0	0
21381	rn nc0s000 aq0000 pr000000 pi000000 vmp0000 nc0s000 sp000 nc0s000 nc0s000 nc0s000 sp000 np00000 np00000	0	0	0
21382	vsip000 rg rg sp000 da0000 nc0s000 vmic000 vmn0000 di0000 nc0s000 nc0s000 pr000000 vmis000 sp000 da0000 nc0s000 nc0p000 vmg0000 da0000 np00000 vsip000 nc0s000 np00000 np00000 rg sp000 pi000000 np00000 nc0s000 da0000 pi000000 np00000 nc0s000 fh aq0000 nc0s000 aq0000 vmis000 nc0s000 sp000 pp000000 vsip000 nc0s000 np00000 cc nc0s000 fh aq0000 pp000000 vmip000 vmn0000 sp000 nc0s000	0	0	0
21383	i nc0s000 np00000	1	1	1
21384	cc vmip000 sp000 pd000000 sp000 np00000 sp000 rg vmip000 vmn0000 da0000 pr000000 vmis000 nc0s000 rg sp000 da0000 aq0000 nc0s000 vmis000 da0000 nc0s000 sp000 np00000 pr000000 dt0000 nc0s000 fh nc0s000 sp000 da0000 nc0s000 aq0000 sp000 da0000 np00000 vsip000 ao0000 pr000000 fh pt000000 da0000 pr000000 vmip000 sp000 nc0s000 aq0000 vmip000 cs fh pt000000 vsn0000 sp000 nc0s000 np00000	0	0	0
21385	aq0000 z0 np00000	1	1	1
21386	np00000 np00000 np00000 pp000000 vmip000 cs rg vmip000 cs rn vsip000 np00000 rn vmip000 cc vmis000 nc0s000 np00000 pr000000 vaip000 vmip000 fit	0	0	0
21388	pd000000 vsip000 nc00000 nc00000 va00000 nc0s000 sp000 da0000 nc0s000 sp000 da0000 np00000 cc pi000000 vmip000 sp000 da0000 nc0s000 cs vmip000 rg sp000 np00000 np00000 pr000000 vmip000 vsg0000 di0000 np00000	0	0	0
21389	da0000 nc0p000 aq0000 aq0000 nc0s000 nc0s000 fh aq0000 rg vmip000 cc pr000000 nc0s000 vmip000 vmn0000 dd0000 vmg0000 sp000 nc0s000	0	0	0
21390	pp000000 vsip000 da0000 nc0s000 rg aq0000 sp000 di0000 nc0s000 nc0s000 da0000 nc0s000 nc0s000 nc0s000 sp000 nc0s000	1	1	1
21391	np00000 aq0000 vmm0000 di0000 vmg0000 di0000 rg rg cc vmis000 vmip000 sp000 np00000 sp000 di0000 np00000 np00000 pr000000 vmip000 nc0p000 sp000 vmn0000 aq0000 nc0s000 np00000 nc0s000 pd000000 vsip000 cs vmip000 di0000 nc0s000 sp000 np00000	1	1	1
21392	rg nc0s000 vmis000 dd0000 nc0s000 aq0000 vmis000 nc0s000 rg vsip000 aq0000 cc np00000	1	1	1
21393	da0000 sp000 vmip000 sp000 cs sp000 dp0000 nc0p000 pp000000 vmip000 cs vmn0000 da0000 nc0p000 i cc sp000 da0000 nc0p000 aq0000 nc0s000 fh aq0000 da0000 vmip000 aq0000	1	0	1
21394	sp000 di0000 nc0p000 sp000 nc0s000 cc nc0s000 z0 vmip000 sp000 vmn0000 cs da0000 rg nc0s000 sp000 pi000000 vsii000 np00000 np00000	0	0	0
21395	pp000000 nc0s000 nc0s000 vmis000 di0000 nc0s000 rg aq0000 nc0s000 fh aq0000 nc0s000 vmip000 sp000 vmn0000 pi000000 sp000 pr000000 da0000 np00000 np00000 np00000 np00000	0	0	0
21396	vaip000 dn0000 nc0p000 rg vmip000 cs vmn0000 sp000 np00000 sp000 vmn0000 di0000 nc0p000 cc vmip000 np00000	0	0	0
21397	vmsp000 nc0s000 sp000 np00000 nc0s000 fh nc0s000 nc0s000 vmis000 vmg0000 cs pp000000 vmsp000 da0000 nc0s000 pr000000 vmis000 cs vmp0000 vmii000 sp000 da0000 np00000 rn vmip000 np00000 np00000	0	0	0
21399	vmm0000 sp000 nc0p000 da0000 nc0s000 sp000 np00000 pp000000 sp000 nc0s000 vsip000 cs da0000 dn0000 nc0s000 fh aq0000 vmip000 sp000 nc0p000 sp000 dp0000 nc0p000 sp000 pd000000 sp000 da0000 pr000000 rg vmis000 cs fh nc0s000 nc0s000 nc0s000 fh aq0000 vmis000 np00000 cc nc0s000 fh aq0000 vmn0000 sp000 pp000000 sp000 dp0000 nc0s000	1	0	1
21400	cc np00000 sp000 vmn0000 nc0s000 nc0s000 da0000 np00000 np00000 np00000 pp000000 sp000	0	0	0
21401	dd0000 np00000 sp000 da0000 nc0s000 cc vmip000 nc0p000 sp000 nc0p000 sp000 vmn0000 rg aq0000 fc cc nc0s000 fh aq0000 vmip000 da0000 nc0s000 sp000 nc0p000 rn np00000 vmip000	1	1	1
21403	rg rg vsip000 vmp0000 nc0s000 np00000 sp000 nc0s000 vsip000 pi000000 aq0000 vaip000 cc sp000 da0000 nc0s000 rg pi000000 sp000 nc0s000	1	1	1
21404	di0000 nc0p000 sp000 vmn0000 da0000 nc0s000 aq0000	0	0	0
21405	w va00000 np00000 np00000 vmip000 np00000 np00000 np00000 sp000 vmn0000 pp000000 nc0s000	0	0	0
21406	cs nc0s000 cc nc0s000 vmip000 cs nc0s000 fh aq0000 vmip000 rg sp000 da0000 nc0s000 fh nc0s000 aq0000 aq0000 dn0000 nc0p000 cc np00000 np00000 np00000 np00000 fg np00000 np00000 np00000 cs pp000000 nc0s000 aq0000 pr000000 rg vmip000 rg aq0000 cc da0000 di0000 fh da0000 di0000 np00000 da0000 nc0p000 aq0000	1	0	0
21407	pp000000 vsip000 rg aq0000 cs di0000 nc0s000 sp000 da0000 nc0s000 nc0s000	0	0	0
21408	pp000000 vmn0000 nc0s000 pr000000 nc0s000 vmip000 di0000 nc0s000	1	0	1
21409	vmsp000 da0000 nc0s000 nc0s000 nc0s000 nc0s000 vsip000 di0000 nc0s000 sp000 nc0s000 cc nc0s000 fh aq0000 nc0s000 vmip000 cs da0000 nc0p000 cc da0000 nc0p000	1	1	1
21410	dd0000 nc0s000 vsip000 di0000 nc0s000 sp000 di0000 dd0000 nc0p000 sp000 nc0s000 nc0s000 rg nc0s000 fh aq0000 aq0000 nc00000 aq0000 np00000 cc nc0s000 vmsi000 fh aq0000 pi000000 sp000 da0000 pr000000 fh pt000000 vmip000 sp000 da0000 pr000000 fh pt000000 vmip000 sp000 np00000 cc nc0s000 pr000000 fh pt000000 nc0s000 fh aq0000 vmis000 da0000 nc0p000 sp000 np00000 di0000 nc0s000 sp000 nc0s000 aq0000 da0000 nc0s000 vmip000 nc0s000 sp000 np00000 pr000000 fh pt000000 vmip000 da0000 nc0s000	1	0	1
21411	da0000 sp000 da0000 nc0p000 vmg0000 da0000 nc0p000 sp000 da0000 nc0s000 aq0000 nc0s000 sp000 nc0s000 vsip000 sp000 np00000 cs sp000 vmn0000 cs vmn0000 np00000 cc sp000 np00000	0	0	0
21412	da0000 nc0s000 pr000000 nc0s000 fh aq0000 nc0s000 vmis000 da0000 nc0s000 sp000 np00000 da0000 np00000 z0 nc0p000 nc0s000	0	0	0
21413	vmsp000 nc0s000 sp000 np00000 nc0s000 fh aq0000 vmp0000 vmm0000 da0000 nc0s000 aq0000 sp000 da0000 nc0s000	0	0	0
21414	vmip000 cc nc0s000 vmg0000 nc0p000 sp000 aq0000 vmsp000 sp000 nc0s000	0	0	0
21415	vmm0000 di0000 np00000 da0000 nc0p000 vsip000 nc0s000 aq0000 nc0p000 rg	1	0	0
21416	vmip000 da0000 pr000000 rg nc0s000 fh aq0000 aq0000 nc0s000 fh aq0000 da0000 nc0s000 sp000 nc0s000 sp000 nc0s000	0	0	0
21418	nc0p000 vmip000 cs da0000 aq0000 da0000 nc0s000 np00000 vsip000 da0000 rg nc0s000 sp000 nc0p000 sp000 nc00000 vmip000 di0000 z0 nc0p000 cc sp000 da0000 ao0000 nc0s000 sp000 da0000 np00000 sp000 di0000 nc0s000 aq0000 sp000 z0 nc0p000 sp000 da0000 nc0s000 da0000 nc0s000 vsip000 sp000 z0 np00000 pd000000 vsip000 np00000	0	0	0
21419	da0000 ao0000 nc0s000 sp000 da0000 nc0s000 sp000 np00000 np00000 np00000 sp000 np00000 np00000	0	0	0
21420	vmip000 da0000 nc0p000 cc rg nc0s000 vaip000 vmp0000 di0000 nc0s000 sp000 nc0s000 sp000 dd0000 np00000 di0000 np00000 nc0s000 fh aq0000 nc0s000 sp000 np00000 vmip000 cs nc0s000 fh aq0000 da0000 nc0p000 vsip000 vmp0000 vsip000 aq0000 nc0s000 pr000000 nc0s000 fh aq0000 pp000000 vmip000 di0000 np00000	1	0	0
21421	aq0000 nc0s000 dd0000 nc0s000 aq0000 nc0s000 np00000 np00000 aq0000 cc np00000	0	0	0
21422	sp000 pn000000 vmip000 sp000 da0000 nc0s000 sp000 nc0p000 cc nc0s000 fh aq0000 pp000000 vmip000	0	0	0
21423	nc0p000 aq0000 vmip000 sp000 da0000 nc0p000 sp000 nc0s000 sp000 nc0p000 aq0000 cc nc0s000 sp000 np00000 cc np00000	0	0	0
21424	np00000 np00000 nc0s000 np00000 nc0s000 sp000 nc0p000 np00000 nc0s000 sp000 np00000 np00000 z0 nc00000 nc0s000 fs cc sp000 w vmip000 sp000 vmn0000 sp000 di0000 nc0s000 np00000 cc nc0s000	0	0	0
21425	nc0s000 vmip000 vsn0000 cs vmsp000 di0000 nc0s000 cc di0000 nc0s000 cs vmii000 nc00000 sp000 da0000 nc0s000 aq0000 pp000000 rg da0000 nc0s000 sp000 nc0s000 vmii000 aq0000 cc nc0s000 sp000 pd000000 vmsp000 sp000 di0000 nc0s000 aq0000 vmsp000 nc0s000 vmn0000 nc0p000	0	0	0
21426	np00000 sp000 np00000 sp000 da0000 aq0000 pr000000 vmip000 vsip000 sp000 vmn0000 cc vmn0000 vmg0000 nc0s000 da0000 np00000 rg vmip000 sp000 nc0p000 sp000 nc0s000 fh aq0000 nc0s000 cc aq0000 np00000 vmip000 vmn0000 sp000 pp000000 nc0s000 fh aq0000 nc0s000 pp000000 vmip000 da0000 np00000 nc0s000 word	0	0	0
21427	rn vmis000 nc0p000 pr000000 vmis000 vmsp000 cc rg nc0s000 pp000000 vmp0000 sp000 nc0p000 rn nc0s000 vmip000 sp000 aq0000 sp000 vmn0000 cs vsip000 di0000 np00000 pr000000 vmsp000 pd000000 nc0s000 aq0000 rg vmip000 rg sp000 da0000 vmip000 aq0000 sp000 cs di0000 nc0s000 nc0s000 aq0000 pr000000 vmsi000 fh aq0000 vmg0000 z0 sp000 di0000 nc0s000 sp000 nc0s000 rg vmip000 nc0p000 sp000 nc0s000	0	0	0
