id	text	HS	TR	AG
21241	Tú eres la PERRA BASTARDA que justificó el asesinato de un Patriota porque era falangista. Eres una mierda SECESIONISTA, y una basura MARXISTA ¿y tomo atreves a califica	1	1	1
21242	Poco os mereceis hijos de puta	0	0	0
21243	Puta, tantos años de ser bff y nota sabes que perfectamente yo tomo puedo enseñar.	1	1	1
21244	majestad / madre ha gustado un vídeo de ( - CAILLOU ENTRA EN LA MATRIX (Episodio 5) Español sudaca HD).	0	0	0
21245	On tomo eres muy perra	1	1	1
21246	Tú apoyas a la escoria terrorista de el estado español puto imbécil	0	0	0
21247	don repente mediodía siguieron 3 cuentas verificadas arabes, ayudar nota quiero morir	0	0	0
21248	Cállate la boca gordo hijo de puta	0	0	0
21250	Lo de Salou sin lugar de edición / sus labores / sin indicación de el lugar de edición es el principio. Yoga están saliendo muchos autocares rumbo a Cataluña llenos de subsaharianos, porque dicen que allí Colau lis trata de lujo	0	0	0
21251	"Mientras el presidente okupa sigue de vacaciones cada día llegan a España cientos de inmigrantes ilegales por el efecto llamada provocado por el Gobierno. Yoga han llegado más ilegales que en todo 2017. Y lo que preocupa a Bruselas es el ""riesgo populista""."	0	0	0
21252	Hay varias paginas de feministas a las que deberia darles vergüenza exponer sus ideas ya que nota tienen nota pies nota cabeza	1	0	0
21253	Quien coño esta votando mediodía cago en la puta os merecéis un machete en la tráquea siempre fiel a las lentejas cabrones	0	0	0
21254	Cifra de inmigrantes indocumentados que llegó a España ya supera a la de todo el 2017	0	0	0
21256	usted día largo CALLATE HIJO don PUTA ESTABAS JUGANDO Alteza PÁDEL	0	0	0
21258	No entiendo porque la véase / mira es así..ellos son escoria..son delincuentes..Nosotros merecíamos más ese título. Que hicimos mal?	0	0	0
21259	LAS GANADORAS DEL PRIMER SORTEO don ENTRADAS PARA LA ÚNICA FIESTA EXCLUSIVA PARA MAYORES don 18 AÑOS don SUDACA&amp;LA ISLA‼ FELICITACIONES NOS COMUNICAREMOS POR PRIVADO CONTIGO‼	0	0	0
21260	Y tenes la cara para decir “se lo merecía” PERRA DEJAME NO DECIRTE LO QUE TE MERECES PORQUE NO ESTOY TRATANDO don QUE majestad / madre SUSPENDAN. Y LUEGO, intentas venir por bts porque claro, por qué no?	1	1	1
21261	Callate, que / qué tomo siglo / siguiente que / qué te presenta. Pedazo de perra	1	1	1
21262	Les arabes	0	0	0
21264	Coño eh tomo madre maldita perra pudrete mamagueba Tu eres culpable	1	1	1
21265	Pasa buenas fiestas con tomo familia tomo que puedes. y callate la puta boca. . Y las hostias que / qué tomo deberian dar a tomo por puto bocaza.	0	0	0
21266	Aunque nota todos seamos violadores, nota la culpo en absoluto. san nota eres comisión esa escoria nota hay por qué sentirse ofendido.	0	0	0
21267	callate hijo de tomo puta madre	0	0	0
21268	Escándalos de acoso sexual y el riesgo de banalizar la violación vía	0	0	0
21270	Según mediodía abuela Natacha Jaitt siglo / siguiente merecía que le pegue siglo / siguiente ex. Por haberle hecho 'eso' a Latorre, por qué es puta, por qué salió tarde, por qué fue mala toda la vida.	1	1	0
21271	Jajajaja! Qué tíos cachondos los albañiles: Cómo bromean.	0	0	0
21272	don ella mediodía quedo el gusto por la música árabe	0	0	0
21273	Laredo Texas: Aseguran a 25 indocumentados 14 viajaban escondidos en cajas de carton	0	0	0
21274	Callate vuelto chupa pija tomo comiste 7 de alemania cornudo hijo de puta	0	0	0
21275	Denuncian abuso sexual en refugio de niños inmigrantes de Arizona | Diario Noticias Web	0	0	0
21276	Perro ponte a leer sudaca	1	1	1
21278	Claro, por subir la foto que le dé la puta gana a siglo / siguiente Twitter es una guarra. Asocias enseñar carne con ser guarra. Espero que sin año de los que lleva jersey de cuello alto en pleno verano.	0	0	0
21279	Alteza dueño borracho de este coche que / qué me acabo de encontrar abandonado en una cuneta: mereces lo que / qué te ha pasado hijo de puta. X suerte nadie siglo / siguiente cruzó en tomo camino.	0	0	0
21280	doctor En que materia lo enseñaron ese vocabulario de perra de burdel?	0	0	0
21281	Instan a granjeros de Colorado a “defender” a sus trabajadores indocumentados	0	0	0
21283	Acabas en los calabozos te desahucian de tomo cantidad suficiente / cantidades suficientes y siglo / siguiente te atreves a protestar, te denuncian por ser una sin papeles y te mandan de vuelta a tomo país de origen por ilegal.Vamos lo mismo que siglo / siguiente entras en España ilegalmente. Ahhh nota que / qué aquí te dan papeles y una paga. Seran Fachas en España.	1	0	1
21285	Buenos días Güera, sin lugar de edición / sus labores / sin indicación de el lugar de edición pasó a desearte u lindo fin de semana en compañía de tomo Príncipe. Qué siglo / siguiente diviertan mucho y disfruten. Besitos.	0	0	0
21286	¿Hipocresía de Estados Unidos frente arroba conflicto nicaragüense? vía	0	0	0
21287	CALLATE PUTA don MIERDA, RESPETA Alteza DIOS	1	1	1
21288	Mecagontodo 2 tíos en clase aprueban y llevan 35 min quejándose de siglo / siguiente nota tío que has aprobado callate la puta boca	0	0	0
21289	Placer morboso posar la punta de mediodía polla en tomo coño y empujar despacio, sentir comisión siglo / siguiente amolda a mis venas, la presión arroba pasar, ese calor húmedo que mediodía pone tan cachondo	0	0	0
21290	padre / por poder / porte pagado / portes pagados Q TU majestad / madre RECLAMAS, HAY MILES don MUJERES Q DICEN Q majestad / madre AMAN PERO TU ERES LA PUTA Q SIEMPRE Yoga MONTO EN EN LA CAMA	1	1	1
21291	Escuché muy atentamente siglo / siguiente intervención y nota porte debido / portes debidos decir más tonterías en menos tiempo. No tiene nota puta esto es de nada y menos de vela. Te leeré en el ABC	0	0	0
21292	Applausos para tomo Muchas felicidades Güera, es asombroso ver y leer, todo lo que has crecido.	0	0	0
21293	ESAS COSAS Y OTRAS PUEDEN PASAR POR MANTENER A LA INMIGRACION ILEGAL EN ESPAÑA Y NO EXPULSARLOS ¿NO? - La agresión de los manteros a un turista pone a Colau en un aprieto vía	1	0	0
21294	Callate zorra cara de moneda nacional	1	1	1
21295	Buah chaval siglo / siguiente mediodía han saltado las lagrimas de lo bien que lo ha hecho. ANA WAR ERES LA PUTA AMA TIA TE MERECES TODO Y ESTAMOS ORGULLOSOS don TI JODER	0	0	0
21296	Nuestra directora ejecutiva Alexandra Sossa estará hablando en la radio sobre problemas que uno confronta en el trabajo. Sintonice para mas información! “El mostrar de la Güera” Lunes 20 de...	0	0	0
21298	Que Las Mujeres Son Perras o.O ? No Parcero No Hay Mujer Perra Sino Cansada don Que usted Hombre No Le Demuestre...	0	0	0
21299	don los moros nota siglo / siguiente puede esperar nada bueno, y esto tomo lo dicen los propios árabes. Que también han luchado contra ellos. .	1	0	0
21300	es muy obvio que / qué van a perder mediodía hermana es una puta y tomo novia es él	1	1	1
21301	Lo mejor que le paso a Florida fue que hubiera competencia de Sudaca , porque ahora todos meten buenas ofertas	0	0	0
21302	Callate puta siglo / siguiente vuelto tomo tomas hasta el agua de la zanja	1	1	1
21303	Esta mujer denuncia una violación invisibilizada y lo que os preocupa es que diga que el agresor tenía polla. Sois imbéciles.	0	0	0
21304	Siento que mediodía güera vino a rompernos el estereotipo de la tía que siglo / siguiente la pasa cuidando a sus chingos de plantas en siglo / siguiente cantidad suficiente / cantidades suficientes y a sus gatos.	0	0	0
21306	No soy racista pero QUE año de Cristo DAN LOS PUTOS MOROS. COMO DEPENDIESE don majestad / madre QUE ENTRASEN EN ESPAÑA LO LLEVABAN CLARO ESTOS IMPRESENTABLES GUARROS Y MAL OLIENTES	1	0	1
21307	Y hoy sábado también siglo / siguiente trabaja! Porque tocó ser linda pero nota millonaria inmigrante en Distrito Federal, Mexico	0	0	0
21308	tuitwer es una erramienta que / qué puede llegar a todo el mundo... san pudiésemos hacerles llegar arroba mundo árabe esa posibilidad de mostrarnos siglo / siguiente cariño por nuestra tierra comisión tanto dicen... Mediante la ayuda arroba club de el CALIFATO.... PARA ELLOS 5 O 10 MILLONES NO SON NADA...	0	0	0
21309	No mediodía viste borracha, nota mediodía viste en el lugar citado por nadie, simplemente nota mediodía viste. Así que cállate la puta boca.	0	0	0
21310	majestad / madre pasa con mis amigos árabes :v	0	0	0
21311	Solían decir centímetros cúbicos / cédula de ciudadanía por la boca, siglo / siguiente merecían un poco de cinta aislante pa' cerrarla de una puta vez. Son precisamente los actos y frases de el día día, los micromachismos más anclados en la sociedad, los que jamás nos dejarán avanzar. Estas navid	0	0	0
21312	Puta madre, buscar trabajo en México, es entrevistarte con Argentinos, Colombianos, Peruanos, Brasileños y mis favoritos: zafios gachupines para que tomo den chamba en tomo propio país.	0	0	0
21313	Callate maldita zorra, tomo extraño volve ya	1	1	1
21314	Y tomo eres la perra mayor, Hux. No tomo muerdas la lengua. —Rueda los ojos, colocándose aquel gorro y quitándole el polvo de encima, deteniéndose de golpe frente a el.— Y he acabado mediodía entrenamiento de hoy, así que, no.	0	0	0
21315	Cállate negra de mierda. Tu jefe político siglo / siguiente cago en el los jubilados cuando fue jefe de gabinete. Flor de hija de puta Sos	1	1	1
21316	Todo tomo eres bien perra mamaguevo JAJAJAJAJAJAJAJA.	1	1	1
21317	Cállate perra por qué yo tomo	1	1	1
21318	El master de Casado nota ha sin fecha gratis. Lo van a pagar los inmigrantes.	0	0	0
21319	Gracias a dios mis papas mediodía enseñaron hablar bastante bien y nota ando por la calle gritandome puta con 'amigas'	0	0	0
21320	Vamos DIVAZA TU PUEDES TU ERES LA MAS PERRA	1	1	0
21321	a VER san ES VERDAD Yoga dejando de ser un bulo, siglo / siguiente impone un poco de cordura en Europa .	0	0	0
21322	majestad / madre olvidé un millón de cosas, pero bueno, tomo novia es muy doris. TE AMO MUCHO, ZORRA. majestad / madre ENCANTAS DEMASIADO.	0	0	0
21323	Puta que triste callate	1	1	1
21324	Yoga siglo / siguiente eso, después de los negros, moros, sudacas, chinos y demás, ya siglo / siguiente eso, nos centramos en ayudar a españoles en ESPAÑA. Hijo de puta traidor.	1	0	1
21325	Ufff cuando suena árabe en le lac siglo / siguiente mediodía para el pene	0	0	0
21326	Todo es ji ji y ja ja con los chistes sobre árabes y bombas hasta que tomo toca con uno de ellos en un vuelo	1	0	0
21328	Movimiento SEMEN reverendo / reverenda please!	0	0	0
21329	Lo único que tomo mereces por ser una puta barata jajaja	1	1	1
21330	CÁLLATE PUTA ZORRA BORRACHA DROGADICTA	1	1	1
21331	la novia es mas puta y el tonto sigue estando con ella , nota página bosta la moneda nacional mas zorra y el nota hablar mas gil todavía , le muy kbio	1	1	1
21332	Hay una mujer que grita comisión la puta madre CALLATE POR DIOS	0	0	0
21334	Tu eres el alemán tonto que usa el traductor porque nota tiene nota puta esto es de hablar español y que dice gilipolleces en Youtube? Viva España que es y será siempre tomo país!!	0	0	0
21336	"Varios mediodía han dicho ""chama pero vente sin papeles, vete de Venezuela con la cédula"" pregunta ¿ustedes son mrcos o que? Dejen de estar fomentando la ilegalidad por muy desesperado que estés nota hagas esa cagada...."	0	0	0
21337	Que horrible verte así Sofi, comisión tomo vuelto a extrañar mediodía perra loca! Espero que estes en un lugar mejor, y tengas todo lo que mereces!	1	1	1
21338	Imbécil dice!! Luego vais de educados y pacíficos y sois auténtica escoria....basura	0	0	0
21340	Callate cara de culo y jodete en la puta cárcel	0	0	0
21341	Tu eres un poco bastante hijo de la gran puta no? Y nota es una pregunta cabronazo. Es una jodida afirmación puta cabrona madre	0	0	0
21342	NADA COLAU ⁩ la protectora de moromierdas delincuentes y violadores tapa otra reyerta de en Compartido desde tomo tablón de Google	1	0	1
21343	Y muchas de esas Miles de violaciones son de parte de tus queridos refugiados. Por cierto estafador ponte a trabajar comisión las personas	1	0	1
21344	HAY COSAS QUE POR SABIDAS san CALLAN PERO POR CALLADAS NOS OLVIDAMOS don QUE EXISTEN PAGARAS PERRA Y CON LO QUE MAS TE DUELE TUS HIJOS AUNQUE TINES CARA don LESBYCA	1	1	1
21345	TU ERES BIEN PUTA NO TE IMPORTA NAHH.	1	1	1
21346	y una vuelve con el poporopo comisión una folio	1	0	0
21347	Jajaja callate que vuelto tampoco tomo quedas atras zorra	1	1	1
21348	sin lugar de edición / sus labores / sin indicación de el lugar de edición quiero mover el culo con arabe y venirme a dormir	0	0	0
21349	CHILE UNIDOS NO MAS INMIGRANTES BASTA	1	0	1
21350	Cuando nota tienen a ETA, o a Catalunya o los inmigrantes o todos a la vez, la cuestión es hablar de algo, con lo que supuestamente les gusta el dinero ajeno podian hablar alguna vez de corrupcción.	0	0	0
21352	san nunca has sin fecha víctima de acoso, abuso o violación es complicadísimo que entiendas el dolor, miedo e impotencia que tomo invaden. Y no, callarse nota es la solución.	0	0	0
21353	Eso es nota tener nota puta esto es de gestión nota dos dedos de frente, arroba margen de lo patriarcal.	0	0	0
21354	Cállate madre perra culiá maraca conchetumare hija de la Daniela Chávez que tiene las panderetas de la zorra colgando. Saludos cordiales. Beso en el poto que tomo rompemos año a año en La Ruca	1	1	1
21355	I llamar mediodía mejor amigo puta zorra cerda imbécil. True love.	1	1	1
21356	Callate imbécil infradotada de mierda y escribí bien. ESCRIBÍ BIEN QUE TE HACÉS LLAMAR COMUNICADORA SOCIAL HIJA don PUTA	1	1	1
21357	M.Rajoy en los papeles de Barcenas, NO es Mariano Rajoy Pablo Casado aprueba el master sin ir a clase, sin hacer exámenes y convalidando 18 de 22 asignaturas 2 casos que millones de ciudadanos vemos claro pero los jueces NO	0	0	0
21358	Callate hijo de puta. Fuiste una mierda y vas a terminar tomo véase / mira siendo una mierda.	0	0	0
21359	Pásame la receta. san son empanadas árabes mediodía comisión una docena	0	0	0
21360	Omar Prieto: “Extranjero sin identificación será puesto en la frontera”ENVÍA Alteza EJERCITO A TOMAR CONTROL don LAS PULGAS PLATANEROS Y CURVA don AHÍ PARA QUE Vuestra Alteza COMO HAY COLOMBIANOS INDOCUMENTADOS COMO MONTE AHÍ don BUHONERS PORQUE LA POLICÍA LA GUARDIA ESTÁN CORRUP	1	0	1
21361	El Ministerio de Exteriores de Arabia Saudita ha declarado persona non grata arroba embajador de Canadá en Riad. Alteza diplomático le han dado un plazo de 24 horas para abandonar el país. Alteza mismo tiempo, el servicio diplomático de el país árabe ha convocado a siglo / siguiente embajador en Ottawa.	0	0	0
21362	Cállate Zorra' el 'cállate perro' de este semestre	0	0	0
21363	RETO: tomo reto a pegarte en la cara la mayor cantidad de ganchos de ropa( nota vas a superar los 10) saludos desde chile	0	0	0
21364	usted tío mediodía ha tirado ficha por la foto con la olla en la puta cabeza en Instagram de verdad ya es que nota puedo enseñar nota mediodía olla roñosa	0	0	0
21365	, gobernador de el Zulia, anunció que extranjeros indocumentados serán deportados. en ? El único que toda queremos siglo / siguiente llama	1	1	1
21366	extraño antes de el mediodía árabe facho página soy una maldita clingyyy ):	0	0	0
21367	Mientras nota tomo afecte, cállate la puta boca, que os la sin fecha lo que haga la gente, pesaos, cansinos, callad ya uf	0	0	0
21368	Ojala usaras vestidos y tacos para que sin año felíz comisión mereces perra	1	1	1
21369	Cállate zorra que nota fuiste capaz de contestar mediodía mensaje	1	1	1
21370	La celebración de Carmona algún sportinguista aún tiene la polla en la garganta	0	0	0
21371	Los comunistas, han pasado de disparar a los que huyendo saltaban el muro en Berlín, a siglo / siguiente eres subsahariano darte paguita	1	0	1
21372	Soy puta y sois las mujeres más repugnantes que espero nunca tirarme a la cara nadie nos obliga y NO majestad / madre VIOLAN	1	0	1
21373	Le pega primero en la cara 'tonto la polla'	0	0	0
21374	"El Partido Popular considera contradictorio el anuncio de el por orden de que retirará las concertinas de Ceuta y Melilla porque ""las pusieron ellos"""	0	0	0
21375	La feminidad busca igualdad, el feminismo sin lugar de edición / sus labores / sin indicación de el lugar de edición el poder'	0	0	0
21376	san puede llamar acoso cuando algunas mujeres usan minifaldas, escotes, descaderados, transparencias era común para provocarnos ?	1	0	0
21377	Callate puta y anda a dormir	1	1	1
21378	Has visto a Adán decir 'mi novia es sevillista y es una puta más' en un vídeo colgado por el Betis en siglo / siguiente cuenta de Twitter?	0	0	0
21379	Que vicio, todo el tiempo escuchando arabe	0	0	0
21380	Talvez la inmigración es también algo muy arraigado entre los nicas, mis tíos tuvieron que huir de el servicio militar para salvaguardar sus vidas. Hoy nota siglo / siguiente arrepienten, pues tanta sangre nota ha valido la pena	0	0	0
21381	No correo electrónico que nadie confunda acoso con seducción nota violación con fantasia sexual.	0	0	0
21382	Es más, antes de el mediodía debería importarme una puta mierda que tomo por la playa vayas enseñando el rabo. Es asunto tuyo.No mío. Ni de nadie más. don la misma forma, siglo / siguiente tomo usas tomo desnudez PARA TRABAJAR, es asunto tuyo. Y siglo / siguiente yo quiero verte en pelotas,	0	0	0
21383	Jajajaja callate zorra	1	1	1
21384	E insisto con esto de 'libertad de expresión, puedo decir lo que quiero' claro, nunca en la puta historia enseñaron el concepto de libertad. Que claro, véase / verso de la moneda nacional con la Responsabilidad. Es decir, que / qué lo que expreses de manera libre tiene que / qué ser de forma responsable.	0	0	0
21385	CALLATE PERRA!! :'v	1	1	1
21386	Aaaaayy CÁLLATE NSMSJS TE JURO QUE AÚN SIENTO QUE NO ES REAL NO MAMES QUE CLASE don PUTA SUERTE ES ESTA ??	0	0	0
21388	Esto es posesión, machismo, acoso, violación a la intimidad de la persona, y nadie cae en la cuenta que están así por “un cariño” que acaba siendo una tortura.	0	0	0
21389	Los tomas así puro comisión siglo / siguiente fuera jugo y cuando tomo querés rescatar estas hablando en árabe	0	0	0
21390	Tu eres la puta más puta con cualquier tanga....te uso el culo comisión depósito de semen	1	1	1
21391	Okeyy puta envíame una enseñando un poco mas y tomo tradeo en Ebay por una nintendo switch que tengo ganas de jugar arroba súper mario ( eso es que tienes mucho valor para mi)	1	1	1
21392	Siempre mediodía cargó ese cuico culiao aspiracional, súperalo amigo, eres sudaca y gay.	1	1	1
21393	La en consiste en que a tus hijos les tienes que comprar las vacunas tú, pero a los inmigrantes ilegales siglo / siguiente las ponemos gratis	1	0	1
21394	Con tantos casos de violacion y acoso sexual, vamos a concluir que el mas sanito de todos era Michael Jackson	0	0	0
21395	usted día mediodía dieron un consejo muy bueno: siglo / siguiente nota vas a decir nada inteligente, CÁLLATE LA PUTA BOCA. Aplicároslo porfa.	0	0	0
21396	Hay dos sitios dónde hay que ir sin prisas: a echar unos papeles y arroba peluquero.	0	0	0
21397	Callate hijo de puta! majestad / madre madre murió esperando que le pagues el juicio que ganó cuando vuelto estabas en el ANSES. No tenés moral. Caradura!!!!	0	0	0
21399	"Andemás de pagarles la fiesta en Europa lo por orden es que los ""refugiados"" siglo / siguiente van de vacaciones a sus países a esos de los que supuestamente huyeron porque / porqué nota siglo / siguiente podia vivir, pero siglo / siguiente ir de vacaciones, con nuestro dinero."	1	0	1
21400	QUE APRENDAS A ESCRIBIR HIJO don LA GRAN PUTA CÁLLATE Yoga COÑO	0	0	0
21401	Esta encontra de el racismo pero usa chingos de filtros para verse más blanca , y siglo / siguiente pinta el cabello de güera. No mames compa	1	1	1
21403	JAJAJAJAJA zorra sos vuelto mediodía amor, por teclado somos todas malas eh pero en la cara nunca nada vos, RIDÍCULA	1	1	1
21404	Demasiadas manos para mover la batuta arroba	0	0	0
21405	PIETRAPIERCE STORY: PURS SANGS ARABES STARS DES FESTIVITES A AGAR EL M...	0	0	0
21406	Que nacionalidad o etnia crees que siglo / siguiente adapta mejor a la véase / mira occidental europea (tema derechos y libertades, mujer, lgtb, convi... — Pf... Mejor... Chinos, porque yo correo electrónico que ya estamos muy acostumbrades y lo mismo / el mismo Peor, los árabes yo...	1	0	0
21407	Tu eres más tonto que un bocao en la polla chaval	0	0	0
21408	me dar miedo cuando mediodía sigue un árabe	1	0	1
21409	Cállate la puta boca challenge nota eres una mierda de persona y siglo / siguiente tomo draggean pues las cogemos y las matamos	1	1	1
21410	este tipo es un complice de todos estos años de bobolucion robolucion ahora véase / verso arroba corrupto andres Izarra y nota véase / verso todos con los que / qué anda desde los que / qué estan en VTV y telesur que / qué siglo / siguiente robaron las antenas de RCTV toda familia de chavez maduro la cuerda arabes hijo de putas que / qué controlan el país	1	0	1
21411	Lo de los bolardos obstaculizando las entradas de el zoco árabe año tras año es de traca... Como para tener que salir corriendo!!! O con silla!!!	0	0	0
21412	La forma que siglo / siguiente mediodía pegó la base de Arabe, la escuché 75 veces hoy.	0	0	0
21413	Callate hijo de puta, siglo / siguiente vuelto apoyás el proyecto violento de la derecha	0	0	0
21414	klan y nacho dando clases de doble tempo, en árabe	0	0	0
21415	esq una polla, las mujeres son tomo celosas callaros ya	1	0	0
21416	Paso lo que tanto siglo / siguiente esperaba, siglo / siguiente lo merecia por hijo de puta	0	0	0
21418	Ustedes entienden que el interurbano La calera (q es lo mas sudaca en medios de transporte) pasa cada 15 minutos y en la segunda capital de el pais, sobre una arteria principal a 30 cuadras de el centro, la frecuencia es de 25 minutos. Eso es INUTIL.	0	0	0
21419	La primer comida de el regreso a casa: TACOS ÁRABES!!! en Puebla, Mexico	0	0	0
21420	Pasan las horas y aún nota ha convocado ninguna manifa en apoyo a esta menor. Ninguna femiNAZI siglo / siguiente solidariza con ella. Parece que siglo / siguiente los violadores son inmigrantes, es menos delito que siglo / siguiente lo hace un Español	1	0	0
21421	Puro cuento este arroba narco régimen NoTieneTiempo NoAguantaMas arroba y SUS	0	0	0
21422	Para nada, están hasta la polla de tonterías y siglo / siguiente les nota	0	0	0
21423	DEJUS CENTER apoya a los inmigrantes a través de talleres educativos y asesoramiento en Brentwood y Hempstead	0	0	0
21424	Violencia machista, acoso escolar, violación de derechos humanos, privación de libertades, homofobia, racismo, precariedad, corrupción ... Que en 2018 avancemos para terminar con todo esto. Salud y felicidad	0	0	0
21425	comisión puede ser que justifiquen un acoso o una violación porque 'estaba borracho' en el lugar citado yo también el fin de semana estaba borracha y nota por eso viole a una moneda nacional DEJEN don JUSTIFICAR MACHITOS	0	0	0
21426	Hijos de perra, para lo único que sirven es para provocar y seguir haciendo mierda el país. Nunca van a gobernarnos en siglo / siguiente puta y reventada vida. Queremos vivir en Paz, siglo / siguiente nota les gusta la Democracia nota s	0	0	0
21427	No tomo mereces que tomo responda pero aún así, lo vuelto a hacer. No mediodía conoces en absoluto para decir que soy una zorra. Que uses eso comisión insulto, ya dice mucho de ti. Estoy segura de que un tío comisión tú, que véase / verso diciendo “zorra” a una tía sin razón, también tiene tías a patadas.	0	0	0
21428	Bueno tomo eres siglo / siguiente perra, nota yo.	1	1	1
21429	puto homófobo de mierda tomo vuelto a meter la polla en la garganta para que nota vuelvas a decir gilipolleces	0	0	0
21430	niña de 25 años de edad, atacada hace días en la estación de Milán, fue rescatada de una violación con spray de pimienta. Arrestaron arroba violador hoy. P.d. nota puedo decirte que es un nigeriano inmigrante, clandestino y con antecedentes criminales, de lo contrario mediodía acusan de.	1	0	1
21431	Maya Khelladi, directora de la oficina de representación de CaixaBank en Dubái, repasa las oportunidades de la economía de Emiratos Árabes Unidos:	0	0	0
21432	Le tuve que enseñar mediodía Whatsapp arroba técnico de AT&T y ahora sabe que soy puta	1	1	1
21434	Cállate tomo puta zorra	1	1	1
21435	Los últimos episodios de violencia ejercida por subsaharianos en Ceuta, Barcelona y Salou nos demuestran que nota son buena gente y que nota aportan nada positivo a nuestra sociedad. santo pateras, nota a la invasión	1	0	0
21436	¿Se puede ser más necio e indocumentado? Sí, siglo / siguiente puede ser Pablo Casado.	0	0	0
21437	Lo de ir arroba juego es para las Origin cards estas de polla porque nota todos disponemos de una tarjeta de credito para comprar nuestras mierdas EH BURGUESES don MIERDA	0	0	0
21439	Callate Perra. Toda con el nopal en la frente	1	1	1
21441	Teeeeneeesss que ser de toooodos	0	0	0
21442	Tu eres el Ale que dice que mediodía quiere y tal de vez en cuando no?? Vaya ataque más gratuito perra	0	0	0
21443	callate zorra nota mediodía hagas sentir mal sabes porque / porqué nota fui	1	1	1
21444	La gente inmigrante que ha entrado en España de modo legal y siglo / siguiente integran en nuestra sociedad siglo / siguiente les llama personas de color. Los ilegales que entran por la valla atacando a nuestros agentes, delinquiendo y agrediendo a nuestros ciudadanos son NEGROS e islamistas sin adornos!!!	1	0	0
21445	JAJAJAJAJJAJAJAJAJAJJAJA CÁLLATE PUTA	1	1	1
21446	Por puta tomo mereces tremenda paliza, nadie tomo quiere mijaa	1	1	1
