id	text	HS	TR	AG
22494	i vmp0000 di0000 nc0s000 dp0000 vmg0000 di0000 rg nc0s000 fh aq0000 dt0000 dt0000 nc0s000 sp000 vmn0000 sp000 da0000 np00000 cc rg nc0s000 nc0s000 pp000000 vmif000 rg aq0000 nc0s000	1	1	1
22495	sp000 da0000 dd0000 nc0s000 dd0000 di0000 da0000 aq0000 nc0s000 sp000 da0000 nc0s000 vmp0000 sp000 vmn0000 da0000 nc0s000	0	0	0
22496	i cs vsip000 rg aq0000 nc0s000 cc vmif000 da0000 nc0s000 pr000000 vmip000 vsn0000 aq0000	0	0	0
22497	rg pr000000 vmii000 da0000 nc0s000 vmip000 aq0000 cc vmp0000 vmg0000 sp000 di0000 np00000 pp000000 nc0s000 np00000	0	0	0
22498	vmsp000 da0000 nc0s000 nc0s000 sp000 nc0s000 sp000 np00000 np00000 np00000 sp000 np00000	0	0	0
22499	vaip000 sp000 nc0s000 sp000 nc0s000 cs fh cs pp000000 sp000 da0000 aq0000 nc0s000 sp000 vmn0000 sp000 di0000 np00000 nc0s000 fh nc0s000 np00000 vmis000 aq0000 nc0s000 cc vmip000 nc0s000 nc0s000 np00000 da0000 pr000000 vmip000 nc0s000 vmsp000 sp000 np00000	0	0	0
22500	np00000 np00000 rg pr000000 vmsp000 da0000 np00000 np00000 vmip000 vmg0000 cs vmsp000 sp000 vmn0000 sp000 np00000 np00000 pd000000 vsip000 vmp0000 vmm0000 dp0000 nc0p000 rg sp000 vmn0000 dt0000 nc0s000	0	0	0
22501	pd000000 np00000 rg vmip000 cs vmn0000 nc0s000 sp000 dd0000 np00000 vaip000 cs nc0p000 sp000 di0000 nc0s000 cc nc0p000 sp000 da0000 pr000000 np00000 sp000 dp0000 np00000 pp000000 vmp0000 sp000 vmn0000 nc0s000 fh aq0000 nc0s000 sp000 nc0s000 cs nc0s000 da0000 np00000 cc sp000 nc0s000 fh aq0000 np00000 vmip000 cs nc0s000 fh aq0000 nc0s000 cc nc0s000 vmif000 nc0s000 fh aq0000	1	0	1
22502	aq0000 dd0000 dn0000 nc0p000 vsip000 da0000 aq0000 nc0p000 pr000000 nc0s000 aq0000 fh nc0p000 aq0000 vmip000 aq0000 pt000000 vmm0000 cs vmip000 vmn0000 di0000 nc0p000 sp000 nc0s000 rg aq0000 cc aq0000	0	0	0
22503	vmis000 np00000 sp000 np00000 vmip000 vmg0000 px000000 nc0s000 nc0s000 vmip000 aq0000 aq0000 sp000 da0000 nc0s000 np00000 da0000 di0000 nc0s000 nc0s000 cc pp000000 vmsp000 nc0s000 sp000 pi000000 pp000000 vmsp000 sp000 da0000 nc0s000 sp000 da0000 nc0s000 cc z0 i da0000 aq0000 pr000000	1	1	1
22504	nc0s000 fh nc0s000 vmip000 da0000 nc0s000 nc0s000 pr000000 sp000 vsn0000 z0 nc0s000 fh aq0000 vmip000 di0000 np00000 np00000 pp000000 cc vmip000 nc0p000 np00000	1	0	1
22505	aq0000 nc0s000 vmip000 vmg0000 nc0s000 fh aq0000 nc0s000 vsip000 di0000 aq0000 nc0s000 sp000 aq0000 aq0000 vmp0000 aq0000	0	0	0
22506	da0000 aq0000 nc0s000 da0000 pr000000 vmn0000 nc0s000 sp000 vmn0000 sp000 di0000 nc0s000 nc0s000 vmis000 nc0s000 vmip000 vmn0000 sp000 nc0s000 sp000 da0000 nc0s000 aq0000 cc nc0s000 sp000 nc0p000 pr000000 vsip000 nc0s000 nc0s000 fh aq0000 dt0000 aq0000 vsip000 cs nc0s000 fh aq0000 nc0p000 aq0000 sp000 rg aq0000 vmip000 van0000 pi000000 pd000000 vsip000	0	0	0
22507	rg pp000000 vaip000 vmp0000 di0000 nc0s000 vmn0000 nc0p000 sp000 np00000 sp000 nc0s000 fh aq0000 nc0s000 rg pr000000 vmii000 di0000 nc0s000 sp000 vmn0000 sp000 np00000 pi000000 nc0p000 sp000 da0000 nc0p000 sp000 nc0s000 fh aq0000 np00000	0	0	0
22508	z0 nc0s000	1	1	1
22509	aq0000 np00000 sp000 nc0s000 sp000 nc0s000 np00000 vmip000 vmn0000 sp000 di0000 nc0s000 aq0000 cc cs pp000000 vmsp000 vmif000 np00000 da0000 vmif000 vmn0000 rg sp000 da0000 nc0s000 cc di0000 da0000 nc0p000	1	0	0
22510	np00000 cc aq0000 rg sp000 pp000000 vsip000 di0000 nc0s000	1	0	1
22511	dd0000 nc0s000 np00000 nc0s000 nc0s000 vmsp000 cc pp000000 nc0s000 fh aq0000 fc nc0s000 aq0000 np00000 aq0000 np00000 aq0000	1	1	1
22512	rn nc0s000 fh aq0000 pt000000 np00000 cc da0000 nc0s000 pr000000 vaip000 vmp0000 pp000000 cs vaip000 da0000 di0000 fh da0000 pi000000 sp000 nc0p000 sp000 np00000 cc sp000 np00000 vsip000 aq0000 vmip000 cc dd0000 nc0p000 vmip000 nc0s000 vmn0000 nc0p000 nc0s000 fh aq0000 vmip000 rg np00000 vmsp000 da0000 pr000000 pp000000 vmsp000 vmn0000 sp000 nc0s000 aq0000 sp000 da0000 nc0s000	1	0	0
22513	sp000 da0000 nc0s000 sp000 da0000 pr000000 aq0000 vmif000 sp000 pt000000 vmip000 sp000 nc0s000 da0000 nc0s000 aq0000 sp000 np00000 rg sp000 van0000 vmp0000 sp000 da0000 nc0p000 pr000000 pp000000 vmsp000 cc sp000 da0000 nc0p000 pr000000 pp000000 np00000	1	0	1
22514	da0000 nc0s000 sp000 np00000 np00000 np00000 np00000 da0000 nc0p000 aq0000 pr000000 vmsp000 sp000 da0000 nc0p000 np00000 np00000 cc di0000 faa aq0000 sp000 nc0p000 fat fp	1	0	1
22515	rg np00000 vmip000 rg nc0p000 vmis000 da0000 nc0s000 np00000 np00000 sp000 da0000 nc0s000 np00000 sp000 da0000 np00000	0	0	0
22516	vmip000 da0000 i vmis000 aq0000 sp000 da0000 nc0s000	0	0	0
22518	da0000 np00000 pr000000 sp000 da0000 nc0p000 aq0000 cc pp000000 vmif000 nc0p000 aq0000 sp000 z0	0	0	0
22519	vmsp000 da0000 np00000 nc0s000 cs rg vmip000 da0000 nc0s000	0	0	0
22520	np00000 cs np00000 da0000 np00000 sp000 da0000 nc0s000 cs vmii000 da0000 np00000 vmii000 np00000 np00000 nc0s000 vsip000 np00000 cc vsip000 di0000 aq0000 nc0s000	1	1	0
22521	cc rg vmic000 cs vmn0000 di0000 da0000 nc0s000 cc dt0000 nc0s000 nc0s000 pr000000 np00000	1	1	0
22522	np00000 np00000 pr000000 nc0s000 vmis000 sp000 np00000 rg nc0s000	0	0	0
22523	nc0s000 fh nc0s000 vaip000 vmp0000 cs vmip000 nc0p000 sp000 np00000 dt0000 vmif000 nc0s000	0	0	0
22524	i nc0s000 np00000	1	1	0
22525	np00000 np00000 np00000 np00000 nc0s000 vmip000 vmsp000 vsip000 di0000 z0 nc0s000 fh aq0000 vmp0000 rg nc0s000 vsip000 cs nc0s000 np00000	0	0	0
22526	sp000 rg nc0s000 nc0s000 fh aq0000 da0000 nc0s000 sp000 cc sp000 nc0s000 sp000 nc0s000 fh dp0000 nc0p000 fh sp000 nc0s000 sp000 da0000 nc0s000 sp000 nc0s000 vmip000 cs vmn0000 cs np00000 vsip000 di0000 nc0s000 sp000 nc0s000 pr000000 vmii000 vmn0000 sp000 nc0s000 sp000 np00000 np00000 cc pt000000 vmip000 sp000 np00000 rg nc0s000 rg cs sp000 np00000	0	0	0
22527	rg vmip000 sp000 da0000 sp000 da0000 nc0s000 aq0000 fh nc0p000 aq0000 sp000 da0000 aq0000 nc0p000 sp000 da0000 np00000	0	0	0
22529	rn vmip000 vmn0000 nc0s000 fh aq0000 nc0s000 nc0s000 sp000 nc0s000 aq0000 sp000 da0000 nc0s000 cc vmn0000 vmn0000 rg	0	0	0
22530	di0000 nc0s000 fh aq0000 sp000 np00000 np00000 aq0000 fi	0	0	0
22531	np00000 aq0000 sp000 di0000 nc0s000 sp000 np00000 aq0000 sp000 da0000 nc0p000	0	0	0
22532	vmsp000 vmsp000 nc0s000	1	1	1
22533	cc vmis000 vsip000 di0000 nc0s000	1	1	1
22534	vmip000 cs vmsp000 di0000 aq0000 nc0s000 cc vmm0000 da0000 pr000000 vmsp000 rg pp000000 cs pp000000 nc0s000 np00000 sp000 aq0000 np00000	0	0	0
22535	nc0p000 sp000 z0 sp000 fh nc0p000 aq0000 sp000 nc0s000 sp000 aq0000 np00000 np00000	0	0	0
22536	pp000000 vsip000 nc0s000 np00000 np00000 aq0000	1	1	1
22537	cs vsip000 nc0p000 pr000000 sp000 vssi000 np00000	1	0	0
22538	i vmis000 da0000 sp000 np00000 vmsp000 vmsp000 nc0s000 vmip000 aq0000	1	1	1
22539	aq0000 sp000 nc0p000 sp000 nc0p000 vmip000 da0000 nc0p000 sp000 da0000 nc0s000	1	0	1
22540	nc0s000 nc0s000 aq0000 nc0s000 pr000000 fh pt000000 nc0s000 vmip000 nc0s000 aq0000 pd000000 vsip000 sp000 pi000000	0	0	0
22541	de0000 vmis000 np00000 np00000 np00000 vmip000 nc0s000 pd000000 pr000000 vmis000 di0000 nc0p000	1	1	1
22542	np00000 np00000 np00000 np00000 pp000000 vsip000 nc0s000 aq0000 vmip000 np00000 np00000 np00000 np00000 np00000 np00000 np00000 nc0s000 np00000 nc0s000	1	1	1
22543	vsip000 pr000000 vsip000 rg aq0000 cc rg vmn0000 di0000 nc0s000 vsip000 vsn0000 di0000 nc0s000	0	0	0
22544	dd0000 nc0s000 aq0000 sp000 da0000 pr000000 vmis000 aq0000 sp000 nc0s000 cc nc0s000 vmip000 rg nc0s000 pp000000 aq0000 nc0s000 cc vmis000 vmn0000 pr000000 nc0s000 sp000 nc0s000 aq0000 np00000	0	0	0
22545	sp000 nc0s000 fh nc0s000 aq0000 fh nc0p000 aq0000 dp0000 nc0s000 di0000 nc0s000 nc0s000 aq0000 cc vmis000 sp000 da0000 nc0p000 ao0000 nc0s000	0	0	0
22546	cc nc0s000 fh aq0000 nc0s000 vsip000 rg sp000 np00000 np00000 nc0s000 np00000 pr000000 nc0s000 vmsp000 sp000 vmn0000 nc0s000 aq0000 np00000	1	1	1
22547	pp000000 np00000 nc0s000 aq0000 fh nc0p000 aq0000 sp000 np00000 pr000000 vmsp000 sp000 di0000 da0000 nc0p000 np00000 vmip000 vmn0000 nc0s000 np00000 cc np00000	1	0	1
22548	vmsp000 da0000 nc0s000 np00000 np00000	0	0	0
22549	nc0s000 dt0000 nc0s000 da0000 nc0s000 vsip000 nc0s000 vmii000 cs nc0s000 vsii000 rg np00000 np00000 ao0000 fg np00000 sp000 da0000 da0000 nc0p000 pr000000 nc0s000 fh aq0000 pt000000 vsip000 aq0000 sp000 nc0s000 sp000 nc0s000 fh dp0000 nc0p000 fh sp000 nc0s000 sp000 da0000 nc0s000 sp000 nc0s000 sp000 da0000 nc0s000 vsip000 sp000 di0000 nc0p000 np00000 np00000	0	0	0
22550	da0000 np00000 vmip000 cs nc0s000 vasp000 nc0s000 sp000 np00000 sp000 da0000 nc0s000 np00000 cc nc0s000 fh aq0000 da0000 nc0s000 pp000000 vmip000 nc0s000 fh aq0000 vmip000 vmn0000 di0000 da0000 nc0s000 di0000 da0000 nc0p000 pr000000 vmip000 sp000 dp0000 nc0p000 vsip000 aq0000 vmsi000 da0000 nc0s000 pr000000 np00000	0	0	0
22551	nc0s000 sp000 np00000 pp000000 pp000000 vmip000 sp000 nc0p000 pp000000 vmsp000 cs pp000000 vmis000	0	0	0
22552	vmis000 da0000 aq0000 rg aq0000	1	1	1
22553	fg vmip000 vaip000 vmp0000 sp000 nc0s000 sp000 nc0s000 fh dp0000 nc0p000 fh sp000 nc0s000 sp000 da0000 nc0s000 sp000 nc0s000 vaip000 vmp0000 dn0000 nc0p000 sp000 da0000 nc0s000 sp000 aq0000 pr000000 np00000 vmii000 pi000000 pr000000 nc0s000 fh aq0000 vaii000 vmp0000	1	0	0
22554	cs nc0p000 sp000 aq0000 nc0s000 pd000000 vmsp000 sp000 da0000 nc0s000 sp000 nc0s000 sp000 nc0s000 fh dp0000 nc0p000 fh sp000 nc0s000 sp000 da0000 nc0s000 sp000 nc0s000 vmip000 vmn0000 dd0000 nc0s000 sp000 np00000 da0000 nc0s000 sp000 da0000 nc0s000 sp000 np00000 np00000 rg vmis000 nc0s000 sp000 vmn0000 aq0000 sp000 di0000 nc0s000 sp000 np00000	0	0	0
22555	vmm0000 sp000 vmn0000 nc0s000 sp000 nc0p000 aq0000 sp000 da0000 nc0s000	0	0	0
22556	dd0000 nc0s000 vsip000 di0000 np00000 di0000 nc0s000 di0000 nc0s000 cc di0000 np00000	1	1	1
22557	aq0000 vsip000 da0000 nc0s000 sp000 di0000 np00000 np00000 np00000	1	1	0
22558	i vmm0000 pp000000 vmif000 pd000000 rg sp000 da0000 nc0s000 word np00000	1	1	1
22559	i np00000 da0000 np00000 vmip000 np00000 np00000 vmis000 vsip000 pi000000 np00000 cs pp000000 vsip000 rg np00000 cc pr000000 nc0s000 fh aq0000 np00000	1	1	1
22561	np00000 np00000 rg vmis000 da0000 nc0s000 vmip000 sp000 vmn0000 da0000 nc0p000 cc vmn0000 sp000 nc0p000 np00000	1	1	1
22562	np00000 nc0p000 vmsp000 da0000 nc0s000 nc0s000 sp000 di0000 nc0s000 nc0s000 vmis000 da0000 nc0s000 vmii000 np00000 vmis000 vmg0000	0	0	0
22563	np00000 np00000 np00000 nc0s000 vmip000 np00000 sp000 nc0s000 nc0s000 np00000 np00000 cc sp000 nc0s000 aq0000 nc0s000 pr000000 pr000000 vmsp000 da0000 nc0s000 pr000000 vmip000 nc0p000 sp000 da0000 nc0s000 sp000 np00000	1	0	0
22564	cs da0000 np00000 nc0s000 fh aq0000 vmip000 aq0000 cc vmip000 nc0s000 da0000 np00000	0	0	0
22565	cc vmip000 np00000 da0000 np00000 pr000000 vmis000 nc0p000 rg sp000 da0000 aq0000 np00000 cs nc0s000 vmip000 sp000 vmn0000 da0000 nc0s000	0	0	0
22566	vmis000 di0000 nc0s000 np00000 cc vmis000 sp000 di0000 da0000 nc0p000 cs da0000 aq0000 nc0s000 sp000 nc0s000 sp000 nc0s000 fh dp0000 nc0p000 fh sp000 nc0s000 sp000 da0000 nc0s000 sp000 nc0s000 vmip000 np00000 vmip000 rg sp000 da0000 z0 ft sp000 nc0s000 cc sp000 nc0s000 sp000 nc0s000 fh dp0000 nc0p000 fh sp000 nc0s000 sp000 da0000 nc0s000 sp000 nc0s000 vmip000 np00000 np00000 sp000 da0000 nc0p000 sp000 pr000000 vmis000 vmip000 da0000 z0 da0000 z0 da0000 nc0s000 aq0000 fh nc0p000 aq0000 cc da0000 np00000 vmip000 sp000 nc0s000 np00000	1	0	0
22567	rg vmip000 cs da0000 nc0s000 vsip000 di0000 nc0s000 pr000000 pp000000 vmii000 aq0000 cc da0000 pi000000 vsip000 di0000 z0 nc0s000 vmip000 np00000 np00000 np00000	0	0	0
22568	vmsp000 nc0s000 fh aq0000 aq0000	1	1	1
22569	vmis000 vsip000 np00000 nc0s000 aq0000 nc0s000 np00000 nc0s000 vmip000 aq0000 nc0s000	0	0	0
22570	i nc0s000 vmif000 da0000 nc0s000 cc np00000 vmis000 vmip000 vmn0000 cc vmm0000 sp000 nc0s000 aq0000 sp000 nc0s000	1	1	1
22571	sp000 pt000000 da0000 nc0p000 vmip000 da0000 nc0s000 sp000 da0000 nc0s000 cc da0000 sp000 pp000000 i rg rg vmn0000 aq0000 nc0s000 di0000 np00000 sp000 nc0s000	1	0	1
22572	da0000 aq0000 cc aq0000 nc0s000 sp000 vmn0000 sp000 da0000 nc0s000 sp000 nc0s000 cc vmsp000 sp000 da0000 nc0s000 da0000 nc0s000 sp000 nc0s000 np00000 pp000000 vmis000 nc0s000 sp000 dd0000 nc0s000 cc nc0s000 np00000 sp000 rg cs rg vmip000 vmip000 rg pr000000 np00000 nc0p000 cc da0000 np00000	0	0	0
22573	nc0p000 da0000 nc0s000 vmsp000 np00000	1	1	1
22576	i vmip000 sp000 da0000 nc0s000 vmip000 nc0s000 fh aq0000 nc0s000 fh nc0s000 sp000 np00000 aq0000 aq0000 z0 da0000 nc0p000 sp000 sp000 nc0s000 fh sp000 nc0s000 sp000 z0 nc00000 aq0000 nc0s000 cc pd000000 nc0s000 vsip000 sp000 z0 di0000 nc0s000 i np00000 cc sp000 np00000 nc0p000 da0000 vmip000 rg sp000 np00000 np00000 sp000 vmn0000 vmp0000	1	0	1
22577	np00000 nc0s000 np00000 sp000 np00000 sp000 vmip000 rg sp000 pr000000 vaip000 nc0s000 np00000 vmn0000 np00000 np00000 fg	0	0	0
22578	vmm0000 cs nc0s000 fh aq0000 vmip000 di0000 nc0s000 sp000 di0000 nc0s000 fit vmm0000 cs pi000000 vsip000 np00000 vmip000 nc0s000 cc vmip000 sp000 nc0s000 cc da0000 pi000000 vmip000 sp000 da0000 nc0s000	1	0	0
22579	vmsp000 nc0s000 vmsp000 vmp0000 aq0000 nc0s000 nc0p000 vmip000 nc0p000 aq0000 aq0000 aq0000 aq0000 nc0s000 sp000 z0 np00000 nc0p000 np00000 nc0s000 nc0p000 aq0000 fh nc0s000 sp000 nc0s000 aq0000 aq0000 aq0000 nc0s000 sp000 nc0s000 nc0s000 sp000 nc0s000 nc0s000 sp000 aq0000 aq0000 nc0s000 nc0s000	1	1	1
22580	np00000 vmsp000 di0000 nc0s000 pp000000 rg aq0000 pr000000 vmis000 np00000 pr000000 nc0s000 nc0s000 cc nc0s000 pr000000 rg nc0s000 np00000 sp000 dd0000 nc0s000 rg nc0s000 vmis000 nc0s000 cc nc0s000 sp000 da0000 nc0s000 nc0s000 sp000 vmn0000 da0000 nc0p000	0	0	0
22581	nc0s000 nc0s000 vmis000 sp000 di0000 nc0s000 pr000000 vsip000 sp000 nc0s000 aq0000 pr000000 vmip000 vmip000 nc0s000 aq0000 rg di0000 np00000 cc pr000000 rn vmip000 pi000000 vmm0000 vmm0000 aq0000 z0 aq0000 nc0s000 aq0000 sp000 np00000 cc dp0000 aq0000 cc rn np00000 np00000 rn nc0s000 fh nc0s000 vmsp000 nc0s000 cc vmip000 nc0s000 nc0s000 vmn0000 aq0000 sp000 np00000	1	1	1
22582	vsip000 sp000 pt000000 vmip000 vsip000 aq0000	0	0	0
22583	sp000 cs da0000 aq0000 nc0s000 fh aq0000 nc0s000 vsip000 rg aq0000 nc0s000 vmsp000 nc0s000 nc0s000 nc0s000 cs da0000 aq0000 pr000000 vmip000 vsip000 di0000 aq0000 nc0s000	1	1	1
22584	da0000 np00000 np00000 nc0s000 aq0000 np00000 aq0000 np00000 sp000 vmip000 dn0000 sp000 da0000 aq0000 sp000 np00000 sp000 np00000 aq0000 nc0p000 aq0000 cc nc0p000 nc0s000 pn000000 nc0p000 nc0s000 np00000 vmg0000 nc0p000	1	0	1
22585	np00000 nc0p000 cs np00000 cc np00000	1	0	1
22586	vmsp000 nc0s000 sp000 np00000	0	0	0
22587	nc0s000 fh nc0s000 vmis000 cs sp000 da0000 nc0p000 sp000 nc0s000 nc0s000 nc0s000 vaip000 cs np00000 cc np00000	0	0	0
22588	nc0s000 nc0s000 aq0000 np00000 vmip000 cs vmip000 sp000 vmn0000 sp000 np00000 np00000 np00000 di0000 pi000000 pr000000 np00000 np00000	0	0	0
22590	i nc0s000 sp000 nc0s000 sp000 dd0000 np00000 np00000 vsip000 rg aq0000 cs da0000 nc0p000 aq0000 vmm0000 sp000 da0000 nc0p000 z0 rg pr000000 vsip000 pi000000 aq0000 sp000 np00000 fg np00000 np00000 aq0000 aq0000 np00000 vsis000	1	0	1
22591	aq0000 nc0s000 nc0s000 vsip000 aq0000 vsip000 di0000 nc0s000 rg pd000000 vaip000 vmp0000	1	1	1
22593	rn nc0s000 fh aq0000 cs aq0000 nc0s000 sp000 nc0s000 fh nc0s000 aq0000 np00000 pr000000 vmip000 nc0s000 sp000 di0000 nc0s000 cs nc0s000 sp000 vmn0000 sp000 nc0s000 sp000 nc00000 np00000 pp000000 rg nc0s000 vsip000 pi000000 px000000 vmis000 nc0s000 sp000 di0000 nc0s000 rg vssi000 sp000 aq0000 cc aq0000 nc0p000 rn pp000000 vmip000 nc0p000 sp000 pi000000 sp000 da0000 pr000000 vmsp000 vmg0000 rg	0	0	0
22595	i aq0000 nc0s000 sp000 da0000 nc0p000 nc0s000 nc0s000 fh aq0000 da0000 nc0s000 fp	0	0	0
22596	aq0000 vmip000 sp000 da0000 np00000 cc vmip000 dd0000 nc0s000 sp000 np00000 cc rg vmip000 nc0s000 di0000 sp000 vmn0000 nc0s000 vmis000	1	0	1
22597	sp000 di0000 nc0s000 vmip000 sp000 np00000 nc0s000 fh nc0s000 vmip000 da0000 nc0s000 sp000 da0000 nc0s000 pr000000 vmip000 vmg0000 da0000 nc0s000 np00000 np00000 aq0000 cc nc0s000 np00000 np00000 sp000 da0000 nc0s000 aq0000 cc nc0s000 sp000 nc0p000 sp000 np00000 pd000000 vsip000 da0000 pr000000 vmsi000 vmn0000 sp000 np00000	0	0	0
22598	vmip000 cs nc0s000 sp000 np00000 nc0s000 aq0000 pr000000 vmis000 vmsp000 sp000 nc0s000 pr000000 vmis000 np00000 di0000 np00000 np00000 vmis000 np00000 di0000 nc0s000 nc0s000 sp000 da0000 np00000 vmis000 np00000 da0000 pr000000 da0000 nc0s000 cc da0000 np00000 cc nc0s000 vmsp000 dn0000 nc0p000 sp000 nc0s000 cs da0000 nc0s000 vmip000 nc0s000 aq0000	1	1	1
22599	cs nc0s000 pr000000 vmsp000 np00000 cs fh cs da0000 nc0s000 sp000 nc0s000 da0000 np00000 np00000	0	0	0
22600	np00000 np00000 np00000 rg pr000000 fh pt000000 nc0s000 vmip000 rg rg aq0000 nc0s000 vmip000 da0000 pi000000 vmip000 sp000 nc0s000 nc0s000 aq0000 nc0s000	1	1	1
22601	vmip000 nc0s000 fh nc0s000 vmip000 sp000 da0000 aq0000 aq0000 nc0s000 nc0s000 fh aq0000 nc0s000 nc0p000 sp000 da0000 pr000000 vmip000 da0000 nc0s000 vmip000 sp000 da0000 np00000 pr000000 pp000000 vmip000 rg pp000000 fh nc0s000 fh aq0000 vmn0000 cs aq0000 nc0s000 np00000	0	0	0
22602	dt0000 aq0000 sp000 nc0p000 sp000 nc0s000 sp000 pr000000 nc0s000 fh aq0000 da0000 vmip000 sp000 di0000 nc0s000 nc0s000 sp000 nc0s000 fh nc0s000 vsip000 aq0000 cc da0000 nc0p000 vmip000 sp000 da0000 z0 vmis000 sp000 np00000 aq0000 vmip000 da0000 nc0p000 pr000000 di0000 nc0s000 aq0000 cc sp000 pp000000 dp0000 nc0s000 rg nc0s000 vsip000 aq0000 nc0s000 vmip000 vsn0000	1	0	1
22603	da0000 nc0s000 sp000 da0000 aq0000 vmip000 di0000 nc0s000 aq0000 sp000 di0000 nc0s000 np00000 cc rg aq0000 nc0p000 sp000 np00000 np00000 pr000000 vmip000 np00000	0	0	0
22604	di0000 nc0s000 vsip000 nc0s000 cc da0000 pr000000 pp000000 vmsp000 vsip000 di0000 aq0000	0	0	0
22605	i nc0s000 np00000 np00000 np00000 nc0s000 fh aq0000 vmip000 sp000 vmn0000 nc0s000 fh aq0000 nc0s000 sp000 np00000	0	0	0
22606	np00000 cs da0000 nc0p000 vmp0000 rg nc0s000 sp000 nc0s000	0	0	0
22607	i pt000000 vmip000 cs nc0s000 fh aq0000 vmsp000 di0000 nc0s000 sp000 di0000 nc0s000 cc di0000 nc0s000 pr000000 sp000 nc0s000 rg aq0000 cc nc0p000 vmg0000 sp000 nc0s000 aq0000 np00000 np00000 vmip000 pi000000 np00000 nc0n000 np00000 aq0000 np00000	0	0	0
22608	nc0s000 da0000 nc0s000 aq0000 vmis000 nc0s000	1	1	1
22609	da0000 aq0000 nc0s000 np00000 cc nc0p000 aq0000 vsip000 di0000 nc0s000 sp000 vmn0000 sp000 pp000000 cc vmip000 sp000 rg sp000 vmip000 aq0000 np00000 vmis000 da0000 nc0p000 sp000 vmn0000 da0000 nc0s000 vmip000 da0000 np00000 np00000 di0000 aq0000 nc0s000 sp000 nc0p000 cc nc0p000 aq0000 aq0000 vmip000 dn0000 pi000000 sp000 nc0p000	1	0	0
22610	sp000 da0000 nc0n000 pi000000 vsip000 aq0000	0	0	0
22611	nc0s000 sp000 vmg0000 vmg0000	1	1	1
22612	da0000 aq0000 nc0s000 sp000 np00000 np00000 cc np00000 aq0000 vsip000 cs da0000 ao0000 vmip000 aq0000 ao0000 di0000 nc0s000 np00000	0	0	0
22613	nc0s000 fh nc0s000 nc0s000 vsip000 aq0000 nc0p000 sp000 np00000	0	0	0
22614	vmm0000 cs nc0s000 fh aq0000 vmip000 da0000 nc0p000 sp000 da0000 nc00000 nc00000 pr000000 nc0s000 fh aq0000 nc0s000 aq0000 pr000000 vmip000 nc0s000 cc nc0s000 nc0s000 fh aq0000 vaip000 vmp0000 np00000	1	0	0
22615	vmsp000 vmis000 nc0s000 sp000 aq0000 nc0s000 fh aq0000 nc0s000 nc0s000 vmip000 nc0s000	0	0	0
22616	np00000 np00000 rg vmip000 aq0000 nc0s000	1	1	1
22617	np00000 fg	0	0	0
22618	da0000 nc0s000 sp000 vmg0000 sp000 da0000 nc0s000 sp000 nc0s000 cs vmii000 vaip000 pp000000 vmip000 nc0s000 aq0000 pd000000	1	1	1
22619	vmsp000 da0000 nc0s000 nc0s000 cs vaip000 vmp0000 rg sp000 nc0s000 sp000 nc0s000	0	0	0
22620	nc0s000 aq0000 np00000 vmip000 sp000 da0000 np00000 cc vmis000 vsip000 aq0000 pt000000 i sp000 np00000 np00000 np00000 pp000000 vmip000 aq0000	1	1	1
22621	da0000 aq0000 np00000 da0000 pr000000 nc0s000 fh aq0000 vmip000 sp000 nc0p000 sp000 dp0000 nc0p000 np00000 nc0s000 cs np00000 aq0000 nc0s000 fh aq0000 vmip000 sp000 da0000 nc0s000	0	0	0
22622	pp000000 nc00000 nc00000 cc di0000 nc0s000 aq0000 aq0000 nc0s000 sp000 nc0s000 dd0000 nc0s000 sp000 nc0p000 aq0000 vmsp000 sp000 pp000000	1	0	1
22623	pd000000 vsip000 da0000 nc0s000 sp000 da0000 pr000000 vmip000 nc0s000 vmip000 vmn0000 rg nc0s000 sp000 nc0s000 sp000 nc0p000 aq0000 sp000 rg pi000000 vmip000 cs vmii000 rg vmip000 di0000 nc0s000 cc sp000 vmn0000 di0000 nc0s000 cc nc0s000 rg nc0s000	0	0	0
22624	rn sp000 nc0s000 aq0000 cc vmm0000 sp000 di0000 pd000000 sp000 da0000 nc0s000	1	1	1
22625	vsm0000 dd0000 nc0p000 vmip000 rg sp000 vmn0000 sp000 da0000 aq0000 vmg0000 cc vmif000 rg sp000 nc0p000 aq0000 np00000	1	0	0
22626	da0000 sp000 np00000 nc0s000 sp000 da0000 nc0s000 aq0000 cc vmis000 vsip000 rg np00000 cs vmip000 nc0s000 np00000 pp000000 vmip000 np00000 da0000 nc0s000 vmip000 vsg0000 vmp0000 da0000 aq0000 nc0s000 vsip000 cs pp000000 vmip000 pt000000 vmip000 sp000 vmn0000 np00000	1	1	1
22627	vmm0000 sp000 pt000000 vmip000 da0000 nc0s000 sp000 nc0p000 rg aq0000 sp000 da0000 nc0s000 sp000 da0000 nc0s000 sp000 nc0s000 aq0000 nc0s000 vmip000 vmn0000 dd0000 nc0s000 vmip000 np00000	1	0	0
22628	pp000000 vsip000 rg np00000	1	1	0
22629	cs pi000000 pp000000 vmsp000 sp000 np00000 pr000000 vmsp000 sp000 np00000 sp000 nc0s000 sp000 vmn0000 sp000 np00000 pr000000 nc0s000 vmip000 nc0s000 aq0000 np00000	0	0	0
22630	i nc0p000 np00000	1	0	1
22631	da0000 aq0000 cs vmis000 np00000 cc di0000 nc0p000 rg pr000000 vmis000 vmis000 nc0s000 cc dp0000 np00000 np00000 np00000 nc0s000	0	0	0
22633	pp000000 np00000 sp000 di0000 np00000 sp000 da0000 nc0s000 cc da0000 np00000 di0000 nc0s000 vmsp000 da0000 vmip000 cs pp000000 vmip000	0	0	0
22634	pp000000 np00000 pr000000 vmip000 sp000 da0000 nc0p000 aq0000 sp000 dp0000 nc0p000 sp000 da0000 np00000 np00000 fg fs vsip000 di0000 np00000 np00000	0	0	0
22635	aq0000 vmg0000 sp000 di0000 nc0s000 sp000 da0000 nc0s000	1	1	0
22636	rg vmip000 cs da0000 nc0s000 sp000 np00000 sp000 nc0s000 sp000 nc0s000 aq0000 vsip000 di0000 nc0s000 aq0000 sp000 np00000 cc da0000 nc0p000 sp000 vmn0000 nc0n000 vmip000 sp000 np00000 nc0s000 aq0000 sp000 nc0p000 sp000 nc0p000 aq0000 rg dn0000 nc0s000 sp000 np00000 vmn0000 rg da0000 np00000	1	0	1
22637	pp000000 aq0000 sp000 nc0s000 sp000 nc0s000 fh dp0000 nc0p000 fh sp000 nc0s000 sp000 da0000 nc0s000 sp000 nc0s000 sp000 dp0000 nc0p000 np00000 np00000	1	1	1
22638	pi000000 rg vmip000 cs nc0s000 sp000 np00000	0	0	0
22639	vaip000 di0000 nc0s000 sp000 np00000 sp000 da0000 nc0s000 np00000 np00000 vmis000 cc vmif000 dt0000 nc0p000 vaip000 sp000 nc0s000 pp000000 np00000	0	0	0
22640	pi000000 pr000000 di0000 nc0s000 vmip000 di0000 np00000 vmn0000 vsip000 cs vmsp000 np00000 vsip000 di0000 nc0s000 rg rg np00000 dd0000 di0000 nc0s000 cs aq0000 vmip000 sp000 nc0s000 sp000 di0000 np00000 np00000 cs vsis000 vmp0000 vmip000 da0000 nc0s000 nc0s000 da0000 nc0p000 nc0s000 np00000	1	0	1
22641	da0000 nc0s000 pr000000 fe sp000 nc0s000 cc nc0s000 nc0s000 vmn0000 di0000 nc0s000 fc nc0s000 fh aq0000 nc0s000 pr000000 da0000 nc0p000 nc0s000 vmip000 nc0s000 nc0s000 sp000 di0000 aq0000 di0000 cc dn0000 cc np00000	0	0	0
22642	np00000 np00000 vmip000 sp000 vmn0000 aq0000 sp000 np00000 np00000 i vmis000 nc0s000 da0000 np00000 di0000 vssp000 word	0	0	0
22643	vmip000 sp000 vmn0000 pr000000 nc0s000 fh nc0s000 np00000 sp000 dp0000 np00000 cc pp000000 vmip000 pi000000 vmip000 sp000 da0000 nc0s000 pr000000 pp000000 pp000000 fh nc0s000 fh aq0000 sp000 vmn0000 di0000 nc0s000 nc0s000 np00000 sp000 da0000 np00000 vmip000	0	0	0
22644	np00000 np00000 np00000 np00000 z0 aq0000 pr000000 vmii000 aq0000 sp000 di0000 nc0s000 aq0000 fh nc0p000 aq0000 sp000 nc0s000 aq0000 sp000 da0000 nc0s000 da0000 np00000 np00000	0	0	0
22645	i np00000 sp000 da0000 di0000 nc0s000 rg vmn0000 aq0000 aq0000 np00000 nc0s000 aq0000 nc0s000 np00000 vmip000 da0000 nc0s000	0	0	0
22646	np00000 aq0000 np00000 np00000 np00000	1	1	1
22647	da0000 nc0s000 sp000 da0000 nc0s000 sp000 np00000 sp000 pi000000 pp000000 vmip000 sp000 da0000 nc0s000 sp000 np00000 sp000 da0000 np00000 i nc0s000 nc0s000 fh aq0000 np00000 nc0s000 nc0s000 fh aq0000 nc0s000 sp000	0	0	0
22648	np00000 sp000 nc0s000 nc0s000 fh nc0s000	0	0	0
22649	rg vmip000 di0000 z0 nc0p000 z0 nc0p000 aq0000 sp000 np00000 np00000	0	0	0
22650	pp000000 vsip000 da0000 nc0s000 sp000 da0000 nc0s000 cc nc0s000 cc nc0s000 vsip000 nc0s000	1	1	1
22651	da0000 nc0s000 sp000 vsn0000 di0000 aq0000 nc0s000 vsip000 np00000 np00000	0	0	0
22652	vaip000 vmp0000 aq0000 sp000 nc0s000 cs nc0s000 nc0s000 vmii000 nc0s000 vmn0000 cs np00000 cc nc0s000 vmip000 di0000 nc0s000 nc0s000 cs nc0s000 fh aq0000 nc0s000 sp000 da0000 nc0p000 vmn0000 sp000 di0000 nc0s000 sp000 vmn0000 vmn0000 rg pt000000 vaip000 vmp0000 pt000000 np00000 pt000000 nc0s000 vmii000 cc pt000000 vaip000 sp000 nc0s000 da0000 np00000	0	0	0
22653	vmm0000 np00000 vmg0000 da0000 nc0p000 aq0000 sp000 da0000 aq0000 sp000 nc0s000 fh aq0000 p0000000 np00000 da0000 nc0s000 vmip000 sp000 da0000 nc0p000 nc0s000 cc np00000	1	0	1
22654	pp000000 aq0000 cc nc0s000 vmp0000 sp000 da0000 nc0s000 sp000 np00000 cc sp000 np00000 rn vmif000	1	0	1
22655	pp000000 vsip000 di0000 np00000	1	1	1
22656	vmsp000 da0000 nc0s000 aq0000 nc0s000 np00000 pp000000 vmip000 sp000 vmn0000 nc0s000 di0000 np00000 nc0s000 sp000 da0000 aq0000 np00000	0	0	0
22657	rn vsis000 nc0s000 pi000000 rg vsis000 nc0s000 sp000 nc0s000 sp000 di0000 aq0000 sp000 np00000 pi000000 da0000 pr000000 vmip000 np00000 np00000 rg da0000 nc0s000 vmp0000 fh nc0p000 aq0000 van0000 vmp0000 di0000 nc0s000 cc nc0s000 da0000 nc0s000 sp000 pr000000 vmsp000 nc0s000 fh aq0000 nc0s000 vmis000 sp000 vmn0000 nc0s000	0	0	0
22659	pp000000 vmis000 vmis000 cs vmis000 nc0p000 aq0000 sp000 aq0000 sp000 np00000 np00000	1	1	1
22662	aq0000 vmip000 sp000 di0000 nc0s000 aq0000 aq0000 nc0s000 nc0s000 sp000 di0000 np00000 rg vmip000 nc0s000 np00000	0	0	0
22663	nc0s000 nc0s000 vsip000 di0000 nc0s000 nc0s000	1	1	1
22664	np00000 sp000 vmn0000 nc0s000 aq0000 dp0000 nc0p000 aq0000 sp000 nc0s000 vmg0000 sp000 da0000 nc0s000 sp000	0	0	0
