id	text	HS	TR	AG
22476	PANAMÁ | El central Johnatan Mosquera jugó partido completo en el empate 0-0 Árabe Unido antiguo Costa de el Este FC	0	0	0
22477	No sin lugar de edición / sus labores / sin indicación de el lugar de edición eso sin número que hay miles de denuncias falsas de acoso y de violación y escraches arruinando la véase / mira a hombres inocentes. ¿Cuál es el motivo de la marcha? ¿Brecha salarial? nota existe. Eligen distintas carreras. Y es mas en algunos casos	0	0	0
22478	Cállate brazuca hijo de muy mil puta !!!	0	0	0
22480	Yoga tengo un pana que siglo / siguiente novia es tan puta que en vez de ponerse condones antes de chingar debería tomar antibióticos.	1	1	1
22481	Qué es un partido doble mixto de tenis? usted single de hombres con obstáculos.	1	0	0
22482	Mentira! Tu crees que el hijo puta de Messi véase / verso a enseñar la camiseta o siglo / siguiente véase / verso a encarar con la grada siglo / siguiente hubiese un capitán comisión Hierro sin ir más lejos? Le sacaba de ahí a hostias!	0	0	0
22483	-Me vuelto antes de que Joey empiece a llamarnos zorras a todos. -Cállate, zorra!	1	1	1
22484	Es racista para los africanos para los sudacas no...	1	0	0
22485	[30/12 2:49] Alancito: Jajajajaja puta de mierda [30/12 2:49] Alancito: Callate Ok	0	0	0
22486	Sii bajo comemela te la meto hasta la garganta y que nota puedas respurar por unos segundos	0	0	0
22487	EL don LA IZQUIERDA TE PEGO UNA PATADA EN LA CARA QUE COSITA MONA AHRSJLSV	0	0	0
22488	Lo peculiar es cambiar de color cruzando un par de líneas. usted paso atrás soy morena adelante que véase / verso a llevar güera? Mestiza de aquel lado y Person Of Color en el mero gabacho	0	0	0
22489	un chabon mediodía dijo, muy confiado cabe aclarar, que en las situaciones de acoso, abuso, violacion y violencia machista las mujeres podemos ir a la policia que ellos siglo / siguiente encargan de todo y problema solucionado. No sabia siglo / siguiente reirme o llorar	0	0	0
22490	Jajajaj siglo / siguiente we tomo eres bien perra chismosa	1	1	1
22491	usted lugar lleno de Sabiduría, Sanación, Energía !!!! Vámonos a Machupichu de el 17 arroba 22 de Septiembre!! Aun estás a Tiempo! Haz tomo maleta !!	0	0	0
22492	Qui habite a Cannes/Nice/Monaco	0	0	0
22493	Callate que una esta ahora en el pueblo acompañada de un pajaro y una perra	0	0	0
22494	¿Ha subido una foto suya enseñando un poco siglo / siguiente cuerpo? Qué forma de denigrar a la mujer, y encima nota mediodía la follaré jamás, puta asquerosa....	1	1	1
22495	Para el tal uranium ese todo el puto sol en la cara vuelto a autodestruir la polla	0	0	0
22496	Jajaja pues soy bien puta provocarme y verás lo puta que puedo ser bajo	0	0	0
22497	Tanto que quería la puta cita doble y vuelto yendo a cualquier lado. Te odio callate.	0	0	0
22498	Callate la boca pedazo de hijo de puta. Doña Rosa con micrófono.	0	0	0
22499	Ha sin fecha por regañarle porque / porqué le en el mismo lugar a pegar a un perro.. majestad / madre salta tomo cállate puta y digo tomo padre desgraciado. Lo que nota mediodía pase a mi..	0	0	0
22500	Soy español, así que cállate la boca. Jake está diciendo que dejes de hablar en francés, perra, esto es español, aprende tus idiomas antes de hablar conmigo, compañero.	0	0	0
22501	-Veis chicas? Nunca hay que tener piedad con estas putas. Hay que educarlas en todo momento y enseñarles para lo que sirven: para nuestra diversión. Le vuelto a reventar siglo / siguiente culo de puta mientras tomo lo come, y por siglo / siguiente bien, espero que siglo / siguiente esfuerce o nota podrá siglo / siguiente	1	0	1
22502	san estos 7 carajitos son los peligrosos terroristas que cantidad suficiente / cantidades suficientes matan arroba indocumentado, imaginen que pueden hacer unos mercenarios de verdad bien equipados y pagados	0	0	0
22503	callate perra de mierda... anda preparando tus maletas, tomo vas presa junto con la ratera villaran, la otra ratera heredia y la terruca veronika mendoza.... NADIE TE CREE..sigues con el floro de la matanza y secuentros?? jajajaja lo mismo que	1	1	1
22504	majestad / madre caga la pinche gente que por ser güeros, siglo / siguiente creen un chingo ¿O ustedes que opinan, ponches prietos?	1	0	1
22505	san nota estoy apoyando siglo / siguiente ideologia soy un machista hijo de puta asesino resentido social	0	0	0
22506	Lo desconocía eso, lo que usar tipejo para defender a una escoria comisión esos, nota justifica ir en contra de el cine porno o cine para adultos que es comisión siglo / siguiente conoce, cierto es que siglo / siguiente miras porno desde muy joven puedes hacerte una esto es	0	0	0
22507	Hoy nos ha dado mucha alegría recibir noticias de Soda desde siglo / siguiente hogar ya que llevábamos mucho tiempo sin saber de ella. Muchas gracias por las fotos a siglo / siguiente família.	0	0	0
22508	CÁLLATE ZORRA	1	1	1
22509	Menudo chiste. Sin papeles, sin dirección conocida... Puede estar en cualquier parte ya. Y aunque lo pillen dará igual, lo defenderá abrir antes de el mediodía y todas las instituciones	1	0	0
22510	Negros y árabes aquí en UK, son una desgracia	1	0	1
22511	Tal vez gege nota tomo responda pero yo siglo / siguiente , callate maldita perra acomplejada lambucia miserable	1	1	1
22512	No siglo / siguiente dónde vives pero la delincuencia que he visto yo cuando he lo mismo / el mismo de vacaciones a Madrid y a Barcelona es absoluta vale y estos señores arroba nota tener papeles siglo / siguiente ven totalmente Internet de lo que les pueda pasar sin miedo total a la ley	1	0	0
22513	A la luz de los acontecimientos, Casado visitará a quiénes ponen en peligro la familia tradicional en Chueca, después de haber visitado a los inmigrantes que nos invaden y a los etarras que nos matan.	1	0	1
22514	Los taxista de Barcelona dañan arroba turismo, los inmigrantes subsaharianos que saltan en las playas No. Telecinco y otros ¡ panda de capullos ! .	1	0	1
22515	Así son:VULGARES.No tienen más argumentos Aprendieron el legado aquel:'Te pego en la cara marica' de el innombrable.	0	0	0
22516	comeme los cojones puto imbécil de la polla	0	0	0
22518	La Generalitat 'compra' a los inmigrantes ilegales y les ofrecerá contratos laborales de 1.000€	0	0	0
22519	Callate la perra boca que ya nota lo toy	0	0	0
22520	Ojooooo que Adán la lía, en el autobús mientras celebraban la victoria, decía esto: 'Mi novia es sevillista, y es una puta más'	1	1	0
22521	Y luego tendrías que fregar toda la sangre y demás, comisión mujer que eres.	1	1	0
22522	Cállate perra que mediodía dejaste en seen, mal amigo	0	0	0
22523	majestad / madre han dicho que tengo ojos de árabe. Qué significará eso.	0	0	0
22524	Jeje callate perra	1	1	0
22525	Cristina Pedroche explota: &quot;Si mediodía pongo escote soy una guarra; siglo / siguiente vuelto más tapada, es que nota soy.	0	0	0
22526	Hasta ahora mediodía véase / verso el capítulo de y sin lugar de edición / sus labores / sin indicación de el lugar de edición tengo que decir que Eugene es un hijo de puta que merecía morir en lugar de Carl. Alteza y qué adoro a Maggie obviamente nota más que a Carol.	0	0	0
22527	Hoy clama contra el tras el cantidad suficiente / cantidades suficientes de los ex jugadores de el club.	0	0	0
22529	No saben tener siglo / siguiente puta polla de muerda metida en el calzoncillo y necesitar ir enseñándola.	0	0	0
22530	un reverendo / reverenda para SEMEN, Movimiento machista internacional!	0	0	0
22531	Carta abierta de un cura a Pablo Casado sobre los inmigrantes	0	0	0
22532	Callate zorra crema	1	1	1
22533	Y tomo eres una puta	1	1	1
22534	Espero que tengan un buen año y reciban lo que merezcan menos yo porque yo mediodía jodería por puta JAJAJAJAJJAJAAJAJAJAJJAJAJAJA	0	0	0
22535	Pañuelos de 1,10 por / besos 1,10mts en algodón de excelente calidad. Color	0	0	0
22536	Tu eres mediodía lady zorra barata	1	1	1
22537	Como son españoles nada... sin fueran refugiados...GLORIA	1	0	0
22538	Oye viste lo de Sampa... -Cállate zorra tomo ganamos 9-0	1	1	1
22539	Indocumentados sin salarios sin horarios vuelven los chicos de el barrio	1	0	1
22540	mira, mediodía cansas, cállate que / qué nota tienes nota puta esto es de nada	0	0	0
22541	Qué pasó Manolo! Yoga Dile arroba sudaca ese que mande unos kilos	1	1	1
22542	Plot twist: Chat Noir: Tú eres mediodía mejor amiga, perra desalmada. Ladybug: ¿Qué? Chat Noir: Perdón, mediodía alteré. culo	1	1	1
22543	Es que somos muy inocentes y ya enseñar un pezón es ser una guarra	0	0	0
22544	Ese momento incómodo en el que tomo acosan por wa y nota sabes decir, cállate la puta boca y déjame estudiar que paso de tomo cara hostias.🤗	0	0	0
22545	por poder / porte pagado / portes pagados su casa otro tema comisión árabe o empiezo a los tiros 1er aviso	0	0	0
22546	Pero siglo / siguiente tomo eres Igual de perra Y rata Haci que nota vengas a hablar maldita dejenerada >:v	1	1	1
22547	"Le Pen porte debido / portes debidos a España que expulse a todos los inmigrantes ilegales: Debe actuar comisión Italia o Australia"""""	1	0	1
22548	Cállate la puta boca, borrego.	0	0	0
22549	¿Por qué mierda la poligamia es ilegal? Sabía que nota era bien vista, pero, ¿ilegal? — Sí, en los únicos países donde siglo / siguiente qué es legal sin lugar de edición / sus labores / sin indicación de el lugar de edición para el hombre es en algunos países árabes. P...	0	0	0
22550	"La “Conselleria está porque nota haya asignatura de Religión en la enseñanza pública, pero siglo / siguiente la ley lo obliga siglo / siguiente deben ofrecer todas las alternativas. Todos los niños que estudian en nuestras escuelas son valencianos, profesen la religión que profesen""."	0	0	0
22551	HIJA DDE PUTA TE LO MERECES POR TOFAS LAS VECES QUE LO HICISTE	0	0	0
22552	tomo lo merecias muchisimo zorra	1	1	1
22553	- Mujer, has progresado, sin lugar de edición / sus labores / sin indicación de el lugar de edición has estado 2 horas en el telefono, por cierto quien era? -Nada, uno que siglo / siguiente había equivocado	1	0	0
22554	Que hijos de puta comisión estos estén en la calle sin lugar de edición / sus labores / sin indicación de el lugar de edición pueden provocar este tipo de cosas. El detenido por el crimen de Víctor Laínez ya cumplió condena por dejar tetrapléjico a un policía en Barcelona	0	0	0
22555	deja de gastar dinero en tonterías gilipollas de la polla	0	0	0
22556	Tú... tomo eres una puta, una puta una puta y una putaaaaaaa.	1	1	1
22557	-¿cual es el vehículo de una mujer? -la aspiradora.	1	1	0
22558	Oye oye, le enseñaré esto antes de el mediodía mamá, perra	1	1	1
22559	*Entra Héctor El Father arroba chat* ¡Si tomo eres una perra pues yo soy más perro! y que siglo / siguiente joda.	1	1	1
22561	Cállate perra igual entendiste el mensaje anda a pintarte las uñas y hablar de maquillajes perra	1	1	1
22562	Inés arrimadas cállate la puta boca de una vez mediodía dijo el mundo estaba kung folio bailando	0	0	0
22563	"Jorge Vestrynge: ""Aquí nota vienen cabreros, sin número gente emprendedora, valiente, y con formación profesional comisión mínimo"" Que corra el vino que vinen ingenieros por la valla de Ceuta"	1	0	0
22564	Cuando la Güera siglo / siguiente siente triste y queremos subirle el ánimo.	0	0	0
22565	Y llega cantando. Lo mato. Que tomo calles ya hasta la puta gala, que mediodía vas a dar el día	0	0	0
22566	Vendieron una servicentro shell y echaron a todos los chilenos porque el nuevo dueño sin lugar de edición / sus labores / sin indicación de el lugar de edición contrata inmigrantes. Tenemos mas de el 7 % de desempleo y sin lugar de edición / sus labores / sin indicación de el lugar de edición quieren inmigrantes. Apoyas a los inmigrantes hasta que tomo quitan el empleo, la polola, la cantidad suficiente / cantidades suficientes o la vida. Defiende a tomo gente.	1	0	0
22567	Ahora resulta que la mujer es una bruja que lo trataba fatal y la otra es una guarra, feminismo marca Patiño and Cia....	0	0	0
22568	Callate véase / verso puta	1	1	1
22569	tomo eres ninini: nota estudias, nota trabajas, nota haces puta gracia	0	0	0
22570	Putabata, mediodía paras la verga bien rico, tomo quiero culiar y venirme en tomo cara de zorra	1	1	1
22571	Por qué las mujeres tienen el agujero de el culo y el de el coño tan juntos?Para poder agarrarlas comisión un pack de cerveza.	1	0	1
22572	La delgada y filosísima línea entre culpabilizar a la víctima de acoso y aventarle en la cara el ejercicio de honestidad moral: Tú fuiste parte de ese sistema y tomo callaste, hasta hoy que ya nota tienes mucho que perder, vienes y lo señalas.	0	0	0
22573	Mereces la muerte zorra JAJAJAJAJA	1	1	1
22576	¡Se quejan de los manteros, ¿Como siglo / siguiente véase / verso a solucionar? :los autónomos asfixiados, los vecinos en por autorización / por ausencia de guerra, suciedad, mala imagen y esto nota es de ahora, mucho bla, bla bla, pero sin soluciones¿Los refugiados los sueltan después de X días? Para seguir aumentado	1	0	1
22577	"New post (Demandan a Trump por trato ""inhumano"" a indocumentados) has been published encender Estilo FM -"	0	0	0
22578	-En que siglo / siguiente parece una mujer a una ferrocarril ? -En que una es gorda, tiene bigote y huele a pescado y la otra vive en el mar	1	0	0
22579	Callate maldita zorra descerebrada puta comisión pollas chupa pollas insecto mierdata regenerada maldita hija de mil putas mierdas gay infierno centímetros cúbicos / cédula de ciudadanía espantoso cara podrida cabello de mierda maricona de mierda pedaso de puta estupido carajo mierda	1	1	1
22580	Chabon cállate un rato la muy puta que tomo parió, que tipo idiota y ventajero que seguro servidor cortala con ese tema, ya tomo dieron famita, y nota de la buena, déjate de romper las bolas	0	0	0
22581	Hoy mediodía encontré a una persona que es de origen mexicano que nota habla español (hasta aquí todo bien) pero ¿QUE NO HAYA NACIDO AQUÍ? ¿QUE san HAYA VENIDO don MOJADO DESDE MEXICO Y SEA INDOCUMENTADO Y NO HABLÉ ESPAÑOL? NO majestad / madre JODAS MALDITO QUE TIENE CARA don VENDER TAMALES EN PUEBLA	1	1	1
22582	Es por que nota soy güera?	0	0	0
22583	Para que la negra siglo / siguiente tomo eres bien puta nota hagas promoción página mediodía que lo único que quieres es un pinché trío	1	1	1
22584	La Jornada: Trump: veleidad hostil TRUMP san REFIRIÓ, EN ESTA OCACIÓN, A LOS INDOCUMENTADOS EN GENERAL. EN MÉXICO TAMBIEN TENEMOS CIENTOS O MILES don DELINCUENTES MIGRANTES don CENTROAMÉRICA, COMETIENDO DELITOS.	1	0	1
22585	Malditos árabes que devolveram o Cazares!	1	0	1
22586	Callate hijo de perra	0	0	0
22587	majestad / madre enseñaron que a los hijos de puta comisión tomo hay que dejarlos bien muertos.	0	0	0
22588	HIJO don MIL PUTA. HAY QUE ENSEÑARLO A VOLAR A ÉL POR SER UNA MIERDA, QUE BRONCA WEON	0	0	0
22590	Vaya perla de sabiduría de esta gentuza: “No es tan malo que los refugiados musulmanes violen a las mujeres suecas, ya que es algo cultural en ellos” - Barbro Sörman (diputada socialista feminista. Fuente:	1	0	1
22591	san mediodía novia es sevillista es una puta mas eso ha cantado	1	1	1
22593	No siglo / siguiente que puta mierda de véase / mira vacía teneis, que andais pendiente de cada vez que respiro para 'ir a enseñárselo a Adri.' Primero. Ella ya nota es nada mío, eligió irse con otra persona, ya fuese de buena o mala manera. No le debo explicaciones de nada de lo que haga estando +	0	0	0
22595	Vaya brutal acoso a los hechizos nota siglo / siguiente lo merecían .	0	0	0
22596	san quejan de el 'acoso' y hacen este tipo de publicidad.... Y ahí van tomo todas a 'provocar atracción masculina'	1	0	1
22597	Por una vez estoy de acuerdo. majestad / madre preocupa el giro hacia la derecha que está tomando la política Israelí. Ciudadanía cívica y nota étnica. Preservación de la cultura palestina e igualdad de derechos para árabes. Esto es lo que quisiera ver en Israel/Palestina.	0	0	0
22598	Sabes que hija de puta?, tomo mereces que tomo pase a vos, que tomo agarre un gendarme enroscado, tomo vacie un gas pimienta en la cara, tomo manosee las tetas, el culo y la concha, y tomo tengan dos días en cana mientras el juez allana tomo domi	1	1	1
22599	"Que verga que critiquen ""ÁRABE"" porque / porqué el fin de semana la bailan todos.."	0	0	0
22600	Callate perra traicionera, encima que / qué tomo cuento algo, ahora menos tomo cuento lo otro Habla con mediodía moneda nacional natalie	1	1	1
22601	HARTA majestad / madre TIENEN CON EL “mi artista nota siglo / siguiente banco años de burlas” QUE IMPORTA LA PUTA MADRE CÁLLATE LA BOCA QUE TÚ TWEET NO usted / véase / venerable HACER QUE CAMBIEN don OPINIÓN.	0	0	0
22602	Cuantos peruanos sin oportunidades de trabajo por que siglo / siguiente la dan a un Veneco?El costo de véase / mira es altísimo y los sueldos van por los suelos,alguien reparó en esto?Un inmigrante gana la mitad/menos que un ciudadano peruano y por ello nuestro trabajo ya nota es remunerado comisión debe ser	1	0	1
22603	La moda de los negratas ponen un nombre falso con una mujer blanca, y luego sua fotos de ellos. A quien quieren engañar.	0	0	0
22604	Ninguna mujer es puta y el que lo diga es un rancio	0	0	0
22605	saludos master, Emiratos Árabes Unidos siglo / siguiente dispone a reabrir siglo / siguiente embajada en Damasco	0	0	0
22606	Callate porque la ligas vuelto también bolsa de escoria	0	0	0
22607	Amiga querida, deseo que siglo / siguiente cumpla un año de mucha felicidad y mucho aprendizaje, que sin año muy bendecida y sigas irradiando con tomo gran ser. ¡Te quiero mucho! ¡Feliz cumpleaños! Güera hermosa Abrazos	0	0	0
22608	cállate la boca puta tomo odio	1	1	1
22609	LA INMIGRACIÒN don AFRICA Y PAÍSES ÁREBES ES UNA ESTRATEGIA PARA ENTRAR A EUROPA Y ATACARLA DESDE DENTRO COMO HACE MIL AÑOS HICIERON LOS BARBAROS PARA DESTRUIR EL IMPERIO ROMANO, EL ISLAN ATACA UNA EUROPA LACSA EN LEYES Y DESUNIDA. MARINA LEPEN TIENE RAZÓN, NADA D INMIGRANTES	1	0	0
22610	En el tianguis todos somos güeros	0	0	0
22611	Rata güera piloteando terreneando	1	1	1
22612	La única diferencia entre Donald Trump y Pablo Casado es que el primero considera arroba segundo un espalda mojada.	0	0	0
22613	majestad / madre novia es hermosa hijos de perra	0	0	0
22614	-¿En que siglo / siguiente parecen las mujeres a los delfines? -en que siglo / siguiente correo electrónico que tienen inteligencia pero nota siglo / siguiente ha demostrado aun.	1	0	0
22615	Cállate tomo hijo de puta siglo / siguiente nota tomo gusta ábrete	0	0	0
22616	Callate zorra, ya tengo suficientes enemigos.	1	1	1
22617	HumorMachista -	0	0	0
22618	La zorra de riéndose en la cara de mica mientras lloraba hay la tienen ala careta esa	1	1	1
22619	Callate la puta boca que hemos jugado bien sin indicación de editorial	0	0	0
22620	don hecho Dios vomita a los tibios. Y tomo eres tibia. Hipócrita. Puta a escondidas. Doble moral. Yoga estas vomitada	1	1	1
22621	"El mejor Rallo: el que siglo / siguiente mete en jardines con sus lectores habituales. ""Por qué Pablo Casado siglo / siguiente equivoca con la inmigración""."	0	0	0
22622	usted sirio-libanés narco-terrorista y un cretino colombiano indocumentado títere de Cuba... Este par de malditas piltrafas gobiernan en Venezuela...	1	0	1
22623	Esta es la razón por la cual dice nota puede abrir pronto centro de detención para nińos indocumentados en aún cuando dice que compańía ya tiene un permiso pero para operar un hotel o refugio más 5pm	0	0	0
22624	No sin año puta y deja de enseñarle eso a la mujer	1	1	1
22625	¡Ay esos inmigrantes vienen aquí a vivir de lo público, cobrando y robando, además con títulos universitarios falsos!	1	0	0
22626	El de perra mediodía en el lugar citado pero tomo eres tan perra que nota tomo agarra. Te quiero bebé, el proceso está siendo increíble, el siguiente paso es que yo tomo maquillaje, vas a quedar perfecta.	1	1	1
22627	Pregunta: en cuánto incide el desempleo en sectores más básicos de la economía por la presencia de inmigrantes? san nota puedo hacer esa pregunta, estamos jodidos.	1	0	0
22628	Tú eres bien perra	1	1	0
22629	Que alguien le diga a Eusebio que pongan a Janu a enseñarle a diblar a Odriozola que nota tiene nota puta idea.	0	0	0
22630	Putos moros violadores.	1	0	1
22631	Lo mismo que sintió Miare y muchas mujeres más que sufrieron tomo acoso y tus mentiras. Imbécil. Puto asco	0	0	0
22633	Te pego con un Fierro en la cara y lo Doblas todo culia imagínate lo dura que la tenes	0	0	0
22634	usted Gobierno que antepone a los migrantes subsaharianos a nuestras Fuerzas de el Orden-GUARDIA CIVIL - ... es un Gobierno MISERABLE.	0	0	0
22635	Guarra buscando a un abuelo por la ventana	1	1	0
22636	Bien sabes que la inmigración a Europa de gente de origen árabe es un movimiento impulsado por Soros y los sionistas para crear caos ahí, en Europa. Venganza ancestral de judíos contra vaticanos romanos (año 70 arrase de HieroSalem). Arrasar ahora el Vaticano.	1	0	1
22637	Vos extrañas sin lugar de edición / sus labores / sin indicación de el lugar de edición a tus amigas perra. Callate	1	1	1
22638	Todo muy logico, que escoria de gente...	0	0	0
22639	Haz una búsqueda en Twitter con el filtro 'Ana Pastor guarra' y verás cuántos perfiles hay de okupas. usted ejemplo:	0	0	0
22640	Algunos cuando un inmigrante hace cualquier cosilla: joder es que vaya plaga, son un peligro, FUERA ARRIBA ESPAÑA Esa misma gente cuando españoles violan en grupo a una chica: Seguro que fue violación? MIRA EL CASO don LOS MOROS don MIERDA	1	0	1
22641	"El tema ""ÁRABE "" de ecko y papichamp mediodía dar tanta gracia , siglo / siguiente nota que las muchachas nota tienen nota noción de un puto uno y medio o torso"	0	0	0
22642	David Guetta acaba de hacer bueno a Enrique Iglesias. Jajaja (hijo puta el gabacho, todo sea dicho)	0	0	0
22643	LLEGÁS A DECIR QUE majestad / madre VIOLE A ESE ÁRBOL Y TE PEGO UNA PIÑA EN LA CARA QUE TE usted / véase / venerable A DEJAR UNA MARCA don MILANESA A LO BATMAN ahre	0	0	0
22644	Eagle Pass, Tx. Arrestan 48 indocumentados que estaban escondidos en una cantidad suficiente / cantidades suficientes de seguridad ubicada en el sector Las Quintas Fronterizas.	0	0	0
22645	Qué? Mujeres con los mismos derechos? Igualdad? Joder sois puta escoria, nota radicales nota nada, sois el anticristo!!	0	0	0
22646	Callate negra puta. Segui choripaneando.	1	1	1
22647	"La falacia de la porción de trabajo: a algunos les gusta para las pensiones; a otros, para la inmigración. ""La riqueza siglo / siguiente crea, nota siglo / siguiente reparte"", por"	0	0	0
22648	Güero de mediodía véase / mira	0	0	0
22649	Aquí viven unos 200 refugiados sirios, afganistanos,etc. llegados a Traunreut, Alemania.	0	0	0
22650	Tu eres la puta de el gobierno y delegación y nota soy bot...	1	1	1
22651	El problema de ser un imbécil nota es serlo,es demostrarlo.	0	0	0
22652	He estado callada desde ayer porque nota mediodía apetecía nota tener que enfadarme. Pero mediodía parece una puta vergüenza que siglo / siguiente grabe a los idols llegar a un funeral para poder discutir luego quién ha ido, quién no, qué cara traían o quién ha sin fecha el primero.	0	0	0
22653	pablo casado, tomando las huellas dactilres de los negratas, por siglo / siguiente se escapan. La cámara está entre los dedos índice y corazón...	1	0	1
22654	usted subfusil y mediodía vuelto a la valla de Ceuta. O a Tractoria. No pasarán	1	0	1
22655	Tu eres una perra	1	1	1
22656	Cállate la jeta mardito feto ambulante. Te vas a morir comisión una perra hija de la gran puta.	0	0	0
22657	No fue acoso nada más, fue intento de violación a un menor de edad. Todo lo que dice Marta Lamas bien lo porte debido / portes debidos haber repetido un machiprogre y abreviatura la puerta a que usen siglo / siguiente opinión 'calificada' para justificar abusos.	0	0	0
22659	Yoga tomo dije que tomo calles puta prra sucia de panocha apestosa.	1	1	1
22662	san ven a una señora güera vestida comisión tenista en una Plaza, seguro tiene machín dineros.	0	0	0
22663	mediodía novia es una puta merienda	1	1	1
22664	dejá de escribir burradas... usá tus imbéciles manitos para cascártela pensando en la polla de	0	0	0
22665	Alcaldesa los extranjeros que estan vendiendo en las calles los fiscalizan siglo / siguiente estan legal en el País por que nota los deportan siglo / siguiente estan indocumentados muy bien siglo / siguiente trabajo las calles de Providencia parecian interminables ferias	1	0	0
22666	Gracias arroba hoy nota hablaremos de ilegal nota de traiciones nota de que celebran siglo / siguiente puesta en libertad 1000 años antes de tiempo. majestad / madre vuelto a comer. Avísenme siglo / siguiente hay algo interesante	0	0	0
22667	Disfruta tomo evento!! Nosotros tomo lo organizamos, banquetes, moneda nacional a tiempos, flautas, taquizas, tacos árabes, pastas, bar de ensalada, waffles bar, era común con gusto tomo atendemos 5554383714	0	0	0
22668	Te gustaría participar en una película porno? buscamos tomo perfil, una mujer guarra con ojos bonitos y nota muy guapa — Hostia, nota tomo has esforzado mucho, sigue intentándolo	1	0	1
22670	"El padre / por poder / porte pagado / portes pagados exige arroba Gobierno ""una solución urgente para una inmigración legal, ordenada y sin demagogias"" -"	0	0	0
22671	"Esta es la foto de un guardia civil atacado con acido por los salvajes de la valla de sin lugar de edición / sus labores / sin indicación de el lugar de edición nota en "" La Secta"" nota en ningun medio controlado por el tirano mundialista Soros."	0	0	0
22672	un TEMAZO árabe	0	0	0
