id	text	HS	TR	AG
23719	nc0s000 nc0s000 fh nc0s000 fh nc0s000 vmif000 sp000 nc0s000 fh sp000 nc0s000 sp000 np00000 np00000 vmn0000 np00000 vsn0000 aq0000 cc vmn0000 da0000 nc0s000 nc0s000 vmip000 np00000 aq0000 np00000 sp000 nc0s000 aq0000 sp000 nc0p000 sp000 aq0000 vmif000 nc0p000 sp000 nc0p000 sp000 da0000 nc0p000 sp000 da0000 nc0s000	1	0	1
23720	aq0000 nc0s000 vmip000 di0000 nc0s000 sp000 da0000 nc0s000 vmis000 ao0000 nc0s000 vsip000 np00000	0	0	0
23721	nc0s000 np00000 da0000 nc0s000 nc0s000 fh nc0s000 nc0s000 fh aq0000 vmip000 sp000 cs sp000 nc0s000 aq0000 fh nc0p000 aq0000 di0000 z0 nc0p000 np00000 np00000 cc di0000 aq0000 nc0s000 sp000 np00000 vsip000 aq0000 cc vmic000 vmn0000 da0000 nc0p000 cc sp000 nc0s000 sp000 nc0s000 fh dp0000 nc0p000 fh sp000 nc0s000 sp000 da0000 nc0s000 sp000 nc0s000 aq0000 nc0s000 vmip000 vmn0000 nc0p000 sp000 np00000	1	0	0
23722	da0000 nc0s000 vmip000 rg nc0s000 sp000 rg aq0000 nc0s000 aq0000 cc sp000 da0000 nc0s000 sp000 nc0p000 aq0000 sp000 da0000 np00000 z0 nc0p000 cc dt0000 nc0p000 da0000 dp0000 vmsp000 nc0s000	1	0	0
23723	sp000 da0000 nc0s000 aq0000 rg aq0000 nc0s000 fh aq0000 sp000 sp000 vmn0000 dp0000 nc0p000 sp000 da0000 nc0s000 sp000 da0000 np00000 cc nc0s000 pp000000 np00000 sp000 pr000000 nc0s000 vmip000 sp000 vmn0000 di0000 nc0s000 sp000 da0000 nc0s000 sp000 da0000 fp	0	0	0
23724	np00000 vaip000 vmp0000 nc0s000 di0000 np00000 pr000000 nc0s000 fh aq0000 vmsp000 da0000 nc0p000 np00000 nc0s000 sp000 nc0s000	1	0	1
23725	nc0s000 rg nc0s000 fh nc0s000 da0000 nc0s000 sp000 nc00000 aq0000 nc0s000 nc0s000 vsip000 pt000000 vsip000 da0000 nc0s000 pr000000 sp000 nc0s000 sp000 nc0s000 fh dp0000 nc0p000 fh sp000 nc0s000 sp000 da0000 nc0s000 sp000 nc0s000 sp000 nc0s000 cs vmsp000 da0000 nc0s000 p0000000 aq0000 np00000 nc0p000	0	0	0
23726	nc0s000 fh nc0s000 vmip000 cs nc0s000 fh aq0000 da0000 nc0s000 nc0s000 rg vsip000 nc0s000 vmg0000 da0000 nc0p000 sp000 da0000 nc0s000 cc nc0s000 da0000 sp000 nc0p000 rg sp000 pd000000 vsip000 da0000 aq0000 np00000 sp000 vmn0000 cs vsip000 aq0000 cc nc0s000 nc0s000 fh aq0000 nc0s000 i	0	0	0
23727	np00000 vmic000 vmn0000 nc0p000 aq0000 sp000 np00000 aq0000 nc0n000 z0 vmsp000 word	0	0	0
23729	pp000000 vsip000 pi000000 aq0000 nc0s000 sp000 nc0s000	0	0	0
23730	sp000 vmn0000 nc0s000 sp000 nc0s000 aq0000 np00000 rg aq0000	0	0	0
23731	pp000000 vmp0000 nc0s000 vmn0000 nc0p000 rg rg sp000 nc0s000 nc0s000 fh nc0s000 nc0s000 sp000 nc0s000	0	0	0
23732	np00000 np00000 np00000 sp000 vmn0000 np00000 sp000 nc0s000 aq0000 nc0s000 fh nc0s000 vmis000 di0000 np00000	0	0	0
23733	pp000000 vmip000 aq0000 nc0s000 fh aq0000 vmis000 sp000 da0000 nc0s000 sp000 np00000 vmif000 sp000 dd0000 nc0s000 vsip000 da0000 nc0s000 sp000 da0000 nc0s000 fh nc0s000 aq0000	1	1	1
23734	rg cs vmip000 vmn0000 da0000 nc0s000 sp000 nc0p000 pr000000 fh pt000000 nc0s000 vmip000 nc0p000 cc vmip000 aq0000 sp000 rg sp000 dp0000 dd0000 vmip000 vsn0000 aq0000 cc rg vmn0000	1	0	1
23736	rg sp000 z0 nc0p000 vmip000 sp000 np00000 sp000 vmn0000 da0000 z0 nc0p000 aq0000 aq0000 pi000000 sp000 nc0s000 np00000 vmip000 np00000 vsip000 pp000000 nc0s000 sp000 da0000 nc0s000 cc pp000000 np00000 sp000 aq0000 vsip000 aq0000 pp000000 fh nc0s000 fh aq0000 sp000 vmn0000 cs np00000 nc0s000 np00000 cs vsip000 nc0p000 pr000000 vmic000 z0	1	0	1
23737	cs nc0s000 nc0s000 nc0s000 fh aq0000 vmip000 nc0p000 sp000 np00000 nc0s000 fh aq0000 pp000000 vmii000 rg cs di0000 da0000 vmp0000 pd000000	0	0	0
23738	vmsp000 vmp0000 nc0s000	1	1	1
23739	pp000000 vmip000 nc0s000 vmic000 aq0000 sp000 nc0s000 aq0000 fc pp000000 vmic000 sp000 aq0000 nc0s000 vmic000 nc0s000 sp000 dd0000 nc0s000 vmn0000 rg sp000 di0000 np00000	0	0	0
23740	aq0000 nc0s000 fh aq0000 aq0000 nc0s000 pp000000 vmip000 rg nc0s000 sp000 nc0s000 cc vmip000 nc0s000 nc0s000	1	1	1
23741	np00000 vmsp000 aq0000 nc0s000 pp000000 vmip000 sp000 nc0s000 vmip000 vmg0000 sp000 da0000 aq0000 nc0s000 nc0s000 aq0000 nc0p000 aq0000 vmip000 sp000 vmn0000 cs nc0s000 vsip000 aq0000	0	0	0
23743	i rg nc0s000 fh aq0000 vsis000 cc np00000 pp000000 vmm0000 vmsp000 cc vmsp000 sp000 da0000 np00000 nc0s000 fh nc0s000 nc0s000 nc0s000 vsip000 rg vsis000 nc0s000	0	0	0
23744	cc rg nc0p000 sp000 dd0000 nc0p000 aq0000	1	0	1
23745	vmn0000 sp000 nc0s000 nc0s000 vsip000 sp000 nc0s000 sp000 nc0s000 fh dp0000 nc0p000 fh sp000 nc0s000 sp000 da0000 nc0s000 sp000 nc0s000 sp000 cs di0000 pr000000 di0000 nc0s000 nc0s000 fh aq0000 nc0s000 vmsp000 sp000 z0 nc0s000 np00000 vmip000 nc0s000 vmip000 da0000 nc0s000 vmis000 da0000 nc0s000	1	0	1
23746	da0000 aq0000 nc0s000 aq0000 fh nc0p000 aq0000 sp000 da0000 nc0s000 pr000000 sp000 nc0s000 sp000 nc0s000 fh dp0000 nc0p000 fh sp000 nc0s000 sp000 da0000 nc0s000 sp000 nc0s000 nc0s000 fh aq0000 nc0s000 nc0s000 fh aq0000 da0000 nc0s000 vsip000 di0000 nc0s000	0	0	0
23747	np00000 np00000 da0000 nc0s000 pr000000 vmis000 np00000 vmip000 dn0000 nc0s000 sp000 np00000 np00000 rg nc0s000 sp000 nc0n000 da0000 nc0s000 vmip000 sp000 nc0s000 nc0s000	0	0	0
23748	vmip000 da0000 nc0s000 vmip000 cc np00000 np00000 np00000 w	0	0	0
23749	da0000 nc0s000 vmip000 sp000 np00000 np00000 aq0000 sp000 nc0p000 pr000000 nc0s000 aq0000 np00000 vmn0000 sp000 dn0000 nc0p000 sp000 nc0s000 vsip000 di0000 aq0000 vaip000 di0000 nc0s000 sp000 dp0000 nc0s000 vmic000 vmn0000 rg nc0p000 sp000 vmn0000 sp000 rg nc0p000 np00000 np00000	0	0	0
23752	np00000 cc pp000000 aq0000 nc0s000 sp000 nc0s000 rg aq0000 np00000 vmii000 vmn0000 sp000 da0000 dn0000 aq0000 rg vmip000 rg cs pi000000 vmip000 sp000 da0000 nc0s000 rg pp000000 aq0000 nc0s000 cs nc0s000 i nc0s000 nc0s000 fh nc0s000 aq0000	0	0	0
23753	pp000000 aq0000 vmp0000 sp000 da0000 nc0s000 sp000 di0000 nc0p000 sp000 np00000 np00000 vsip000 da0000 pr000000 vmip000 sp000 da0000 nc0p000 aq0000 np00000 di0000 sp000 pp000000 aq0000 nc0p000 sp000 nc0p000 cc nc0p000 sp000 dp0000 nc0p000 nc0s000	1	0	1
23756	np00000 nc0s000 fh aq0000 vsip000 rg aq0000 sp000 nc0s000 aq0000 aq0000 nc0s000 sp000 nc0s000 pr000000 vmif000 cs p0000000 vmif000 da0000 nc0p000 vmip000 nc0s000	1	1	1
23757	nc0s000 nc0s000 sp000 nc0s000 np00000	0	0	0
23758	rg vmp0000 sp000 da0000 nc0s000 sp000 da0000 ao0000 nc0s000 sp000 np00000 cc np00000 rg vmip000 sp000 da0000 np00000 z0 np00000 cc sp000 da0000 aq0000 np00000 nc0s000 np00000 z0 nc0p000 aq0000 sp000 np00000 vmis000 vmif000 nc0s000 fh aq0000 np00000 np00000 nc0s000 np00000	0	0	0
23759	pt000000 i pr000000 vmip000 da0000 np00000 aq0000	0	0	0
23760	vmsp000 da0000 nc0s000 nc0s000 sp000 aq0000 cs vmip000	0	0	0
23761	cs vmis000 vsip000 rg np00000 np00000	1	1	1
23762	vmsp000 da0000 nc0p000 nc0s000 vmip000 word vmm0000 da0000 aq0000 nc0s000 vmip000 nc0p000	1	0	0
23763	vmis000 nc0s000 fp nc0s000 vsip000 di0000 nc0s000 cc vmm0000 pp000000 vmif000	1	1	1
23764	rg nc0s000 pd000000 vsip000 sp000 da0000 pr000000 np00000	0	0	0
23765	rg vmip000 sp000 da0000 nc0s000 aq0000 nc0s000	0	0	0
23766	vmip000 sp000 np00000 vmip000 dn0000 nc0p000 sp000 zm sp000 vmn0000 da0000 nc0s000 aq0000 sp000 np00000 cc nc0s000 vsip000 da0000 ao0000 nc0s000 np00000 rg nc0s000 di0000 nc0s000 cc da0000 aq0000 sp000 np00000 nc0s000 da0000 vmif000 np00000	1	0	1
23767	nc0s000 sp000 nc0s000 nc0s000 aq0000 vmip000 nc0s000 aq0000 dd0000 nc0s000	0	0	0
23768	de0000 nc0s000 cs vmsp000 sp000 da0000 nc0s000 aq0000 nc0s000 fh aq0000 vmis000 vsip000 rg aq0000	1	1	1
23769	np00000 vmsp000 fg np00000 vmis000 vsip000 aq0000	1	1	1
23770	np00000 sp000 rg nc0p000 aq0000 aq0000 cc aq0000 aq0000 np00000 pd000000 vsip000 np00000 cc nc0s000 vmif000 cs p0000000 vmsp000 dp0000 nc0s000	1	0	1
23771	nc0s000 nc0s000 z0 nc00000 pp000000 vmip000 da0000 nc0s000 nc0s000 np00000	1	1	1
23772	pd000000	0	0	0
23773	fg np00000 nc0s000 vsip000 aq0000 cc vsip000 di0000 nc0s000 rg np00000 fg rg pr000000 vmip000 vmn0000 sp000 da0000 z0 np00000 fg np00000 sp000 nc0s000 nc0s000 vmm0000 fg np00000 dp0000 np00000	1	1	1
23774	da0000 nc0s000 sp000 nc0s000 nc0s000 vmis000 sp000 vsn0000 vmn0000 nc0s000 pr000000 rg vsip000 cc pt000000 rg sp000 da0000 nc0s000 ap0000 nc0s000	1	1	1
23775	vmsp000 sp000 vmn0000 nc0s000 dp0000 nc0s000 aq0000 z0 da0000 nc0s000 dp0000 nc0s000 sp000 aq0000 sp000 dp0000 nc0p000 vsip000 di0000 nc0s000 sp000 aq0000 nc0s000 sp000 da0000 np00000 nc0s000 fh aq0000 vmip000 sp000 np00000 nc0s000 cc nc0s000 aq0000 sp000 di0000 nc0s000 sp000 zm vsg0000 pd000000 di0000 nc0s000 aq0000 np00000	0	0	0
23776	np00000 sp000 nc0s000 vsip000 da0000 rg sp000 da0000 nc0s000 vmsp000 da0000 nc0s000 nc0s000 vmip000 nc0s000 aq0000 fh nc0p000 aq0000 z0 nc0p000 pr000000 nc0s000 vmip000 word	0	0	0
23778	rg aq0000 vmsp000 cc sp000 da0000 nc0p000 pr000000 fh pt000000 vmip000 sp000 dp0000 nc0s000 vmip000 cs fh pt000000 da0000 vmsp000 di0000 sp000 nc0p000 sp000 np00000 pr000000 rg vmip000 vaip000 sp000 nc0s000 nc0s000 np00000	1	0	1
23779	sp000 vmn0000 da0000 nc00000 fz pr000000 vmip000 sp000 nc0s000 fh aq0000 nc0s000 aq0000 fh nc0p000 aq0000 aq0000 nc0s000 fh aq0000 np00000 nc0s000 sp000 aq0000 nc0s000	0	0	0
23780	rg sp000 nc0s000 vmip000 sp000 np00000 sp000 vmn0000 pt000000 vmip000 sp000 nc0s000 sp000 dd0000 nc0s000 aq0000 sp000 da0000 np00000 np00000 z0 nc0p000 pr000000 vmip000 vmis000 di0000 nc0s000 sp000 da0000 nc0p000 sp000 da0000 nc0s000 np00000 sp000 np00000 cc di0000 nc0s000	0	0	0
23781	z0 np00000 np00000 nc0s000 np00000 cs vmip000 rg pp000000 vmip000 np00000	1	1	1
23782	nc0s000 sp000 rg dn0000 nc0s000 aq0000 di0000 nc0s000 sp000 da0000 aq0000 nc0s000 sp000 np00000	1	1	1
23784	vmip000 sp000 cc nc0s000 nc0s000 rg vmip000 np00000 np00000 np00000	1	1	1
23785	vmip000 sp000 vmn0000 nc0s000 fh aq0000 vaip000 di0000 aq0000 sp000 da0000 nc0s000 sp000 nc0s000	0	0	0
23786	np00000 sp000 nc0s000 cc nc0s000 vsip000 di0000 nc0s000 aq0000 pr000000 vmip000 da0000 nc0s000 fh nc0s000 sp000 vmn0000 sp000 di0000 nc0s000 sp000 nc0s000	0	0	0
23787	sp000 dd0000 nc0s000 vmip000 sp000 nc0s000 da0000 nc0s000 np00000 nc0s000 nc0s000 vsip000 rg aq0000 cs da0000 px000000	1	0	1
23788	de0000 nc0s000 vmsp000 da0000 nc0s000 sp000 nc0s000	1	1	1
23789	dd0000 aq0000 dd0000 vmg0000 nc0s000 nc0s000 sp000 np00000	1	1	1
23790	rn vmis000 nc0s000 z0 nc0p000 sp000 nc0p000 cc rg nc0s000 vmip000 vmg0000 vmn0000 da0000 nc0s000 sp000 da0000 sp000 nc0s000 sp000 nc0s000 fh dp0000 nc0p000 fh sp000 nc0s000 sp000 da0000 nc0s000 sp000 nc0s000 sp000 nc0s000 cc sp000 da0000 nc0p000 aq0000	0	0	0
23791	pp000000 vmis000 rg sp000 da0000 nc0s000 nc0s000 cs da0000 nc0n000 nc0s000 vmsp000 di0000 nc0s000 cc nc0p000 aq0000 sp000 pr000000 nc0s000 vmip000 di0000 nc0s000 sp000 vmn0000 pn000000 z0 sp000 nc0s000 cc sp000 nc0s000	0	0	0
23792	cc nc0s000 vsis000 da0000 pr000000 fh pt000000 vmis000 np00000 rg vmis000 cs fh pt000000 vmip000 nc0p000 pr000000 fh pt000000 vmip000 nc0s000 cc pr000000 fh pt000000 pp000000 pp000000 vmip000 cs fh pt000000 vmip000 cs fh pt000000 nc0s000 nc0s000 fh aq0000 vmis000 np00000	0	0	0
23793	dn0000 nc0p000 sp000 np00000 vmp0000 sp000 nc0s000 aq0000 cc aq0000 sp000 nc0s000 sp000 di0000 nc0s000 nc0s000	0	0	0
23794	sp000 np00000 vmip000 vsn0000 pd000000 np00000 vsip000 aq0000 sp000 vmn0000 vmg0000 da0000 nc0s000 sp000 da0000 nc0s000 sp000 np00000 da0000 nc0p000 nc0s000 vmip000 nc0s000 vmn0000 dp0000 nc0s000	0	0	0
23795	vmsp000 np00000 sp000 np00000	1	1	1
23796	rg rg i np00000 np00000 np00000 vmip000 nc0s000 rg vmg0000	1	1	1
23797	sp000 vmn0000 sp000 vmm0000 vmm0000 np00000 np00000 np00000 np00000 np00000 np00000 cc np00000 np00000 sp000 da0000 np00000 np00000 cc nc0s000	0	0	0
23798	vmsp000 nc0s000 fh nc0s000 aq0000 np00000 nc0s000 nc0s000 nc0s000 fh aq0000 da0000 vmii000 sp000 di0000 aq0000 nc0s000 z0	0	0	0
23799	aq0000 cs pi000000 da0000 pr000000 vmip000 di0000 nc0s000 dd0000 nc0s000 cc pi000000 da0000 pr000000 vmip000 di0000 i vsip000 np00000 np00000 vmn0000 nc0s000 fh aq0000 nc0s000 nc0p000 sp000 di0000 dp0000 nc0p000	1	0	0
23801	nc0s000 fh aq0000 nc0s000 fh nc0s000 cs vmip000 aq0000 sp000 nc0s000 di0000 di0000 nc0p000 sp000 da0000 nc0s000 cc nc0s000 aq0000 vmis000 nc0s000 sp000 nc0s000 sp000 nc0p000	1	1	1
23802	rg vaip000 vmp0000 cs vmn0000 sp000 nc0s000 rg sp000 da0000 nc0s000 nc0s000 sp000 rg vmg0000 di0000 da0000 nc0s000 nc0s000 aq0000 cc nc0p000 cc nc0p000 aq0000 sp000 aq0000 nc0s000 sp000 sp000 nc0s000 fh sp000 nc0s000 sp000 cs np00000 vsip000 np00000 np00000 vmip000 cs pp000000 vaip000 vmp0000 vmm0000 np00000 sp000 vmn0000 sp000 pd000000 sp000 nc0s000 vmsp000 sp000 nc0s000 aq0000 nc0s000 aq0000 fh nc0p000 aq0000	0	0	0
23803	nc0s000 fh nc0s000 vmis000 di0000 nc0s000 sp000 nc0p000 fg np00000 fg z0 np00000 sp000 np00000	0	0	0
23804	fd vmip000 sp000 dp0000 nc0p000 sp000 fp np00000 aq0000 sp000 vmn0000 sp000 da0000 z0 nc0p000 aq0000 nc0s000 sp000 nc0p000 aq0000 da0000 nc0s000 vsip000 vmn0000 nc0p000 sp000 vmn0000 nc0s000 fp	1	0	1
23805	rg vmis000 np00000 fp da0000 pr000000 vmip000 vsn0000 dd0000 nc0s000 np00000 np00000	1	1	1
23806	pd000000 vmis000 aq0000 nc0s000 sp000 nc0s000	1	1	1
23807	nc0s000 fh nc0s000 vmip000 nc0s000 z0 vmip000 cs vmif000 da0000 nc0s000 sp000 vmn0000 da0000 nc0s000 nc0s000 np00000	0	0	0
23808	da0000 aq0000 nc0s000 sp000 da0000 pr000000 pp000000 aq0000 vmip000 sp000 np00000 cc vmis000 vsip000 aq0000 cc nc0s000 aq0000	0	0	0
23809	nc0s000 fh nc0s000 nc0s000 sp000 di0000 nc0s000	0	0	0
23810	nc0s000 sp000 nc0s000 sp000 nc0s000 sp000 nc0s000 fh dp0000 nc0p000 fh sp000 nc0s000 sp000 da0000 nc0s000 sp000 nc0s000 aq0000 vmii000 cs vsn0000	1	0	1
23811	pr000000 aq0000 pr000000 da0000 nc0s000 cc da0000 nc0p000 aq0000 fg da0000 pp000000 vmip000 z0 nc0p000 aq0000 sp000 np00000 sp000 vmn0000 da0000 nc0s000 sp000 nc0p000 nc0s000	1	0	1
23812	vmm0000 rg nc0p000 sp000 nc0s000 sp000 nc0n000 nc0s000 vmg0000 sp000 dp0000 aq0000 nc0s000 aq0000 fh nc0p000 aq0000 nc0s000 fh aq0000 vmip000 pi000000 vmis000 nc0p000 sp000 np00000 rg vmii000 di0000 nc0s000 sp000 nc0s000 np00000 nc0s000 aq0000 pr000000 rg vmip000 vmip000 np00000	1	0	1
23813	rg vmip000 sp000 da0000 sp000 np00000 np00000 vmg0000 di0000 nc0s000 aq0000 sp000 nc0p000 sp000 pr000000 vmsp000 da0000 nc0p000 cc vssp000 cc rg sp000 da0000 nc0p000 aq0000	1	0	1
23814	vmis000 nc0s000 vsip000 di0000 np00000 nc0s000 pp000000 vmm0000 da0000 nc0p000 pr000000 pp000000 vmis000	1	1	1
23815	vmsp000 cc pp000000 nc0p000 sp000 da0000 nc0s000 cc da0000 nc0s000 np00000 np00000	0	0	0
23816	vmm0000 nc0s000 aq0000 pr000000 vmip000 da0000 nc0p000 nc0p000 rn vmip000 nc0s000 fh aq0000 vsip000 np00000 nc0s000 np00000	0	0	0
23817	rg vmip000 da0000 nc0s000 pr000000 fh pt000000 vmip000 sp000 np00000 da0000 pr000000 fh pt000000 vmip000 da0000 nc0s000 sp000 np00000 cc vmm0000 sp000 da0000 np00000 np00000 da0000 sp000 da0000 aq0000 da0000 pd000000 vsip000 da0000 aq0000 aq0000 sp000 da0000 nc0s000 nc0p000 cc nc0s000 np00000 pd000000 vsip000 da0000 nc0s000 pr000000 fh pt000000 nc0p000 sp000 dp0000 np00000	1	0	1
23818	np00000 sp000 nc0s000 aq0000 pr000000 vmip000 vmsi000 pi000000 sp000 da0000 vmsi000 sp000 nc0s000 da0000 nc0s000 nc0s000 vmn0000 sp000 dd0000 nc0s000 vmg0000 cc vmip000 sp000 di0000 da0000 nc0s000 np00000	0	0	0
23819	pp000000 pp000000 cs vmip000 vsip000 nc0s000 i cc pr000000 vmis000 vmsp000 nc0s000 word	1	1	1
23820	cs aq0000 vmip000 sp000 nc0s000 sp000 da0000 nc0s000 aq0000 cc sp000 da0000 nc0s000 sp000 dp0000 aq0000 nc0p000 cc rg aq0000 cc nc0p000 vmip000 aq0000 sp000 cs di0000 nc0s000 vmip000 dn0000 sp000 np00000 np00000 np00000 nc0s000 np00000	0	0	0
23821	da0000 sp000 np00000 vsip000 rg da0000 rg pr000000 pi000000 nc0s000 fh aq0000 aq0000 vmsp000 i np00000 da0000 nc0s000 nc0s000	0	0	0
23822	i np00000 np00000 np00000 sp000 da0000 np00000 vmip000 sp000 vmn0000 aq0000 np00000 np00000 cc rg vsip000 nc0s000 sp000 nc0p000 sp000 nc0s000 fh aq0000 np00000 np00000 vmii000 np00000 np00000 sp000 np00000 cc nc0s000 vmn0000 sp000 nc0p000 sp000 da0000 nc0s000 sp000 np00000 np00000 np00000 np00000 np00000 aq0000 z0	0	0	0
23823	np00000 vmip000 sp000 da0000 nc0s000 sp000 nc0p000 nc0s000 nc0s000 sp000 nc0p000 aq0000 sp000 da0000 nc0p000 pr000000 vmis000 nc0s000 rg pi000000 vmip000 sp000 sp000 rg	0	0	0
23824	nc0p000 sp000 np00000 pr000000 nc0s000 pp000000 np00000 da0000 nc0s000 np00000 vsip000 rg cc dp0000 nc0s000 vmip000 vmg0000 nc0s000 np00000 sp000 da0000 np00000	1	0	0
23825	np00000 pp000000 aq0000 nc0s000 nc0s000 sp000 da0000 sp000 aq0000 sp000 np00000 cc di0000 aq0000 nc0s000 np00000 pr000000 vmip000 dn0000 nc0p000 vmg0000 cs nc0s000 fh aq0000 vmsp000 da0000 nc0s000 aq0000 sp000 da0000 np00000 pp000000 np00000 nc0s000 nc0s000 fh aq0000 np00000 vsip000 di0000 nc0s000 np00000	0	0	0
23826	vmsp000 da0000 nc0p000 nc0s000 sp000 nc0n000 fg rn vmip000 cc nc0s000 vsip000 di0000 nc0s000 sp000 nc0p000 np00000	1	1	1
23828	de0000 nc0s000 nc0s000 fh aq0000 cs pp000000 vaip000 np00000 da0000 nc0s000 aq0000 fh nc0p000 aq0000 np00000 vmip000 cs fh pt000000 nc0s000 vmip000 np00000 cs np00000 np00000 cc vmip000 nc0p000 fit aq0000 cs fh pt000000 pp000000 vmip000 da0000 np00000	0	0	0
23829	nc0s000 np00000 vaip000 vmp0000 dd0000 nc0s000 sp000 da0000 np00000 sp000 np00000 sp000 z0 nc0p000 sp000 nc0s000 aq0000 cc vmip000 sp000 pp000000 di0000 np00000 pr000000 vmii000 vmn0000 da0000 nc0p000 aq0000 sp000 nc0s000 sp000 nc0s000 np00000	0	0	0
23831	vsip000 di0000 nc0s000 aq0000 vmsp000 np00000 aq0000 cc vmis000 vmn0000	1	1	1
23832	vmip000 nc0s000 di0000 nc0s000 sp000 nc0s000	1	1	1
23833	rg nc0s000 fh aq0000 cs vmip000 dn0000 cc vmip000 sp000 z0 nc0s000 cc vmm0000 nc0s000 aq0000 nc0s000 sp000 aq0000 rg rg sp000 pr000000 nc0s000 vmsp000	0	0	0
23834	np00000 np00000 nc0s000 aq0000 vmsp000 nc0s000 da0000 pr000000 vmip000 nc0p000 sp000 nc0s000 fh nc0s000 np00000 np00000 z0 rn np00000 nc0p000 rg vmip000 sp000 np00000 np00000 rg rn vmip000 rg rg	1	1	1
23835	vsip000 vmis000 nc0s000 vmn0000 sp000 pp000000 cc vmn0000 dt0000 nc0s000 nc0s000 cc vmip000 da0000 pr000000 np00000	1	1	1
23836	np00000 z0 nc0p000 cc di0000 nc0s000 aq0000 fc nc0s000 aq0000 cs nc0s000 np00000 np00000	0	0	0
23837	i dd0000 dt0000 vmm0000 sp000 vmn0000 pr000000 di0000 aq0000 sp000 aq0000	1	1	1
23838	np00000 np00000	1	1	1
23839	sp000 nc0s000 np00000 nc0s000 pp000000 vmip000 z0	0	0	0
23840	pp000000 vmis000 sp000 nc0s000 aq0000 vmip000 nc0s000 aq0000 aq0000 nc0s000 nc0s000 aq0000	1	1	1
23841	i nc0s000 cs nc0s000 aq0000 np00000 np00000 fc pp000000 nc0s000 fh aq0000	1	1	1
23842	vmsp000 vmsp000 aq0000 vmn0000 i	1	1	1
23843	sp000 np00000 vmsp000 cc cc da0000 nc0s000 pr000000 nc0s000 fh aq0000 vmip000 sp000 vmn0000 np00000 vmip000 da0000 nc0s000 sp000 vmis000 aq0000 sp000 nc0s000	0	0	0
23844	vmip000 cs nc0s000 fh nc0s000 vsg0000 nc0s000 sp000 vmn0000 pi000000 sp000 dd0000 aq0000 np00000 da0000 nc0s000 cc da0000 nc0s000 nc0s000 vsip000 di0000 np00000 np00000 cc nc0s000	1	0	1
23845	np00000 sp000 pt000000 nc0s000 aq0000 sp000 nc0s000 aq0000 word	0	0	0
23846	nc0s000 sp000 nc0s000 da0000 pr000000 vmip000 vmm0000 sp000 nc0s000 nc0s000 vsip000 di0000 nc0s000 rg aq0000 pi000000	0	0	0
23847	nc0s000 fh nc0s000 vmip000 da0000 np00000 sp000 rg pr000000 vmsp000 aq0000 nc0s000 vmip000 np00000	0	0	0
23848	aq0000 nc0s000 sp000 np00000	1	1	1
23849	nc0s000 cs nc0s000 fh aq0000 sp000 di0000 nc0s000 pp000000 vmsp000 di0000 nc0s000 sp000 da0000 nc0s000 aq0000 z0 nc0p000 sp000 nc0s000 cs sp000 da0000 dn0000 nc0p000 pp000000 nc0s000 vmip000 da0000 nc0s000	1	0	0
23850	cc vmis000 vsip000 di0000 rg np00000	1	1	1
23851	nc0s000 fh nc0s000 aq0000 nc0s000 nc0s000 vmis000 sp000 nc0p000 sp000 pp000000 vmis000 sp000 nc0p000 sp000 da0000 nc0s000 np00000 aq0000 nc0s000 np00000 vmis000	0	0	0
23852	pd000000 vsip000 aq0000 vmip000 sp000 nc0s000 nc0s000 np00000 vmip000 nc0s000 cc nc0s000 vmif000 sp000 vmn0000 rg nc0s000	0	0	0
23853	sp000 da0000 nc0p000 sp000 nc0s000 cc nc0s000 z0 vsip000 aq0000 sp000	0	0	0
23854	da0000 aq0000 nc0s000 sp000 da0000 nc0s000 aq0000 np00000 vsip000 da0000 np00000 sp000 np00000 sp000 nc0s000 aq0000 sp000 da0000 nc0s000 pr000000 vmip000 da0000 np00000 np00000 np00000 vmm0000 pp000000 vmif000 z0 nc0p000 sp000 nc0s000 aq0000 nc0s000 da0000 dn0000 nc0p000 pr000000 fh pt000000 vmis000 da0000 np00000 np00000 rg z0 np00000 sp000 nc0s000 aq0000 sp000 fh nc0p000 np00000	1	0	1
23855	nc0s000 sp000 nc0s000	0	0	0
23856	np00000 rg nc0s000 sp000 nc0s000 cs vmip000 aq0000 cs da0000 np00000 nc0s000 nc0s000 fh aq0000 vmn0000 np00000 cc nc0s000 pp000000 vmp0000 sp000 vmn0000 sp000 aq0000	0	0	0
23857	pp000000 vmis000 np00000 np00000 rg vmis000 sp000 nc0s000 sp000 nc0s000 fh nc0s000 aq0000 fh nc0p000 aq0000 sp000 dp0000 nc0p000 cc nc0p000 cc nc0p000 sp000 nc0s000 aq0000 nc0s000 fh nc0s000 vmip000 da0000 nc0s000 sp000 dd0000 nc0s000	1	1	1
23858	vaip000 pi000000 aq0000 pr000000 di0000 nc0s000 cc rg di0000 di0000 nc0s000 vmip000 aq0000 nc0s000 sp000 vmn0000 cs da0000 nc0s000 aq0000 vsip000 np00000 vmif000 da0000 nc0p000 sp000 da0000 nc0s000 sp000 aq0000 np00000 np00000 np00000 nc0s000 sp000 nc0p000 sp000 np00000	1	0	1
23859	pp000000 vmip000 vmn0000 da0000 pr000000 vmis000 nc0s000 fh aq0000 nc0s000 nc0s000 vmip000 rg vmip000 da0000 nc0s000 cc sp000 cs di0000 nc0s000 vsip000 aq0000 rg sp000 np00000 fg nc0s000 pr000000 vmis000 nc0s000 fh aq0000 vmip000 nc0s000 nc0s000 pp000000 vmip000 nc0s000 aq0000 fh nc0p000 aq0000 vmip000 z0	0	0	0
23860	aq0000 cc vmis000 vsip000 pp000000 np00000 np00000 vmip000 da0000 nc0s000 pr000000 pp000000 vmis000 pp000000 vmic000 vmg0000 dn0000 pp000000 aq0000 vmis000 cs vmip000 sp000 vmn0000 da0000 nc0s000 nc0s000 da0000 nc0p000 aq0000 sp000 nc0s000 rg pp000000	0	0	0
23861	cs vmip000 da0000 nc0p000 sp000 da0000 nc0s000 sp000 di0000 nc0s000 sp000 rg vmn0000 da0000 nc0s000 sp000 di0000 nc0s000 rg np00000 vmip000 pi000000 sp000 da0000 aq0000 sp000 nc0s000 da0000 nc0p000 aq0000 cc da0000 aq0000 nc0s000 fh aq0000 vmip000 sp000 vmn0000 da0000 nc0s000 aq0000	0	0	0
23862	fp dd0000 nc0s000 vsip000 np00000 np00000 nc0s000 pp000000 np00000 cc vmn0000 sp000 nc0s000 sp000 nc0s000 sp000 nc0s000 vmn0000 nc0s000 vmn0000 sp000 nc0s000 sp000 nc0s000 pr000000 vmip000 np00000 nc0s000 sp000 da0000 nc0p000 sp000 dp0000 nc0p000 aq0000 sp000 da0000 z0 aq0000 pr000000 vsip000 np00000	1	0	1
23863	da0000 aq0000 nc0s000 sp000 da0000 nc0p000 sp000 nc0p000 sp000 np00000 np00000 aq0000 sp000 di0000 nc0s000 sp000 np00000 np00000 np00000 np00000 np00000 nc0s000 sp000 np00000	0	0	0
23864	rn aq0000 cs rn vmip000 pp000000 vmip000 aq0000 sp000 np00000 aq0000 nc0p000 cc nc0p000 nc0s000 nc0s000 pi000000 nc0s000 di0000 pi000000 aq0000 aq0000 vmp0000 vmip000 aq0000	1	0	0
23865	np00000 nc0s000 vmip000 vsn0000 rg nc0s000 sp000 rg z0 aq0000 da0000 rg aq0000 sp000 nc0s000 nc0s000 aq0000 sp000 da0000 nc0s000 aq0000 vsn0000 vmp0000	0	0	0
23866	aq0000 vmip000 vmn0000 sp000 vmn0000 nc00000 nc00000 sp000 vsn0000 sp000 di0000 nc0s000 sp000 pd000000 da0000 aq0000 pr000000 np00000 rg nc0s000 vsip000 nc0s000 np00000 nc0s000 fh aq0000 vmip000 sp000 di0000 np00000	1	0	1
23867	nc0s000 rg	0	0	0
23868	dd0000 nc0s000 vmii000 vmg0000 da0000 nc0p000 aq0000 np00000 sp000 da0000 nc0s000 aq0000 cc nc0s000 np00000 nc0s000 fh aq0000 vaip000 vmp0000 sp000 da0000 nc0s000 sp000 nc0s000	0	0	0
23869	sp000 pr000000 nc0s000 pp000000 vmis000 sp000 da0000 i np00000 sp000 pt000000 vaip000 vmp0000 sp000 pr000000 sp000 np00000 cc aq0000 np00000 np00000	0	0	0
23870	vmm0000 cc sp000 nc0s000 vmip000 aq0000 cc da0000 nc0s000 np00000 vmg0000 sp000 nc0p000 vmsp000 cc cs dd0000 aq0000 vmif000 nc0s000 cs pp000000 np00000 da0000 nc0p000 vmip000 vmn0000 np00000 sp000 aq0000 cc vmm0000 da0000 nc0s000 vmif000 da0000 nc0s000	1	0	1
23871	aq0000 nc0s000 vsip000 di0000 nc0s000 sp000 nc0s000 rg aq0000 cc nc00000 sp000 dd0000 nc00000 cc np00000 vsip000 aq0000 sp000 da0000 nc0s000 np00000	0	0	0
23872	cs vmsp000 rg da0000 aq0000 cc vsip000 pi000000 aq0000 aq0000 word	1	0	0
23873	di0000 nc0s000 vmsi000 fh aq0000 sp000 di0000 np00000 np00000 np00000 da0000 nc0p000 sp000 da0000 np00000 np00000 np00000 sp000 da0000 nc0s000 sp000 nc0s000 nc0s000	1	0	0
23874	i vaip000 np00000 np00000 da0000 nc0s000 sp000 fit vsip000 sp000 fh nc0p000 vmn0000 nc0s000 fh aq0000 np00000 nc0s000 sp000 nc0s000 np00000	0	0	0
23876	np00000 np00000 np00000 np00000	1	1	1
23877	da0000 pr000000 p0000000 vmip000 vsip000 sp000 rg cc np00000 nc0s000 aq0000 cc np00000	0	0	0
23878	da0000 z0 nc0p000 sp000 cs dp0000 nc0s000 sp000 nc0p000 vmip000 sp000 dt0000 nc0s000 fh aq0000 vmip000 sp000 vmn0000 dp0000 nc0s000 cc nc0s000 nc0s000 sp000 dp0000 nc0p000 rn np00000 rg vmip000 sp000 da0000 nc0s000 sp000 vmn0000 aq0000 dp0000 nc0p000 np00000	1	0	0
23879	rn rg sp000 da0000 np00000 nc0s000 di0000 nc0s000 sp000 nc0s000 aq0000 sp000 nc0s000 sp000 np00000 dn0000 sp000 nc0s000 nc0s000 aq0000 sp000 np00000 rg vmis000 sp000 dd0000 nc0s000 sp000 np00000 sp000 vmip000 np00000	0	0	0
23880	np00000 nc0s000 nc0s000 sp000 nc0s000 fh nc0s000 aq0000 fh nc0p000 aq0000 vmip000 aq0000 vsip000 aq0000 nc00000 di0000 nc0s000 pr000000 vmsp000 fh aq0000 sp000 vmn0000 di0000 da0000 pr000000 vaip000 vmp0000 nc0s000 cc di0000 da0000 nc0p000 aq0000	0	0	0
23881	sp000 da0000 nc0s000 sp000 nc0s000 nc0s000 nc0s000 fh nc0s000 sp000 vmn0000 da0000 aq0000 pr000000 sp000 vmip000 cc rg nc0s000 pp000000 vmp0000 sp000 vmn0000 vmn0000 sp000 vmn0000	0	0	0
23882	sp000 da0000 nc0p000 pr000000 vmii000 sp000 np00000 pp000000 vmii000 nc0p000 aq0000 sp000 da0000 nc0p000 cs vmip000 sp000 nc0s000 sp000 np00000 pp000000 vmip000 nc0p000 aq0000	1	0	1
23883	di0000 aq0000 nc0s000 sp000 np00000 np00000 fit vmip000 cs da0000 nc0p000 sp000 aq0000 vmsp000 nc0s000 np00000 nc0s000 dd0000 nc0p000 sp000 aq0000 np00000	0	0	0
23884	np00000 vsip000 nc0s000 vmip000 da0000 aq0000 nc0s000 vmip000 sp000 vmn0000 nc0s000 sp000 di0000 nc0s000 cc vmip000 da0000 nc0s000 vmip000 sp000 nc0s000 nc0s000 np00000	0	0	0
23885	da0000 aq0000 sp000 nc0s000 np00000 sp000 dp0000 z0 nc0p000 vmis000 nc0s000 fh aq0000 ao0000 nc0s000 i aq0000 sp000 da0000 nc0s000 vmip000 nc0p000 rg sp000 da0000 nc0s000 nc0s000 np00000	0	0	0
23886	z0 np00000 aq0000 sp000 da0000 aq0000 cc z0 nc0p000 aq0000 sp000 np00000 cc di0000 pi000000 z0 nc0s000 np00000 cc da0000 nc00000 nc0s000 np00000 np00000 sp000 vmn0000 nc0s000 np00000 aq0000 aq0000 cc nc0p000 sp000 dn0000 nc0p000 cc nc0p000	1	0	1
